千葉,琉球,北九州,琉球,琉球,山口,愛媛,琉球,岡山,東京Ｖ,琉球,群馬,琉球,新潟,琉球,金沢,町田,琉球,京都,琉球,松本,琉球,琉球,徳島,山形,琉球,琉球,栃木,琉球,大宮,甲府,琉球,福岡,長崎,琉球,磐田,琉球,琉球,琉球,琉球,水戸,琉球
琉球,福岡,琉球,徳島,長崎,琉球,琉球,磐田,琉球,琉球,甲府,琉球,栃木,琉球,山形,琉球,琉球,大宮,琉球,水戸,琉球,千葉,新潟,琉球,琉球,群馬,松本,琉球,京都,琉球,琉球,山口,琉球,琉球,北九州,琉球,東京Ｖ,金沢,岡山,愛媛,琉球,町田
1,1,4,1,1,4,1,2,1,0,1,0,2,1,1,2,4,5,1,3,1,0,0,1,3,0,2,4,2,0,1,1,3,0,1,3,4,0,1,6,0,0
0,1,0,3,1,1,1,2,2,1,2,1,2,0,4,1,2,0,0,2,6,1,1,1,0,1,0,1,1,3,0,0,1,1,1,0,0,2,1,0,2,1
0,1,0,0,1,0,1,1,3,3,0,3,1,0,0,0,0,3,0,3,3,0,0,1,0,0,3,0,3,3,0,3,0,3,1,0,3,0,1,3,3,0
