Round,Hteam,Ateam,Hscore,Ascore,WorL,Preview,Review,H_comment,A_comment
明治安田生命Ｊ２リーグ　第40節,山形,町田,3,5,3,"開幕戦は１－１のドロー決着だったこのカード。シーズン残り３試合となった今節、勝点65同士での再戦となった。得失点差で町田が６位、山形が７位。来季もＪ２を舞台に戦うことがすでに決まり、今季もここから順位の大幅アップが見込めるわけでもない。それでも目指すのは、１つでも上の位置でのフィニッシュ。今節の勝利は、ともに抱えているゴール前での課題克服がカギになる。

山形は２連敗のあと、前節は大宮を相手に２－２のドロー。二度追いついたことには価値があるが、先制されて追いついても引き離され、長い時間でビハインドに立たされる展開は勝利の確率を下げるものだ。味方同士の立ち位置やスペースを突く動きで相手を崩し、シュートチャンスも作れてはいる。先制できれば本当の意味で主導権を握り、試合を優位に進めることができるが、ここ３試合はその先制点が奪えていない状況だ。今節はホーム連戦。早い時間帯にゴールネットを揺らせるかどうかが、４試合ぶりの勝利に直結する。

町田はここ６戦負けなし。２勝４分と勝ち切れてはいないが、４試合を無失点で終えている。また、明治安田Ｊ２第34節・秋田戦と第36節・琉球戦以外は被シュート数を５本以内に抑えるなど、安定した戦いぶりが続いている。その一方で、２勝にとどまっているのは、シュートチャンスや決定機の数に見合った得点を奪えていないことにある。この６戦のうち、３試合が無得点。前節・群馬戦は先制し、シュート数では12対３と大きく上回ったが、スコアは１－１のドローで終えている。安定した試合運びと失点の少なさを盾に、複数得点を実現させて勝利をつかみたい。

［ 文：佐藤 円 ］","このところ、決定力に課題を抱えていた両チームだったが、終わってみればスコアは計８点、シュート数も両チーム合計31本と激しい打ち合いとなった。その中で試合を制したのは、後半に一挙５得点と大逆転の町田。勝点65同士の対戦を５－３で制した。

先制点は早い時間に生まれた。５分、左サイドから攻める山形はスルーパスに加藤 大樹が抜け出し、半田 陸がクロスに合わせた。その直後には町田のハイプレスに圧され、ショートカウンターを受けてバタつく時間もあったが、立ち位置を整理して立て直す。落ち着いて攻撃を再開すると23分、今度は右サイドから。中原 輝を起点に半田が飛び出すと、クロスのこぼれ球をヴィニシウス アラウージョが押し込み、追加点を奪った。

ビハインドの町田は２枚代えで後半をスタート。ミドルシュートを決め切れず無得点が続いていたが、58分、ショートコーナーから土居 柊太が頭で決めて１点を返すと、そこから怒とうのゴールラッシュが始まった。60分には鄭 大世が競ったボールを太田 修介が決めて同点。72分には吉尾 海夏が倒されて獲得したPKを鄭 大世が決めて逆転。さらに85分には安井 拓也のクロスから平戸 太貴が４点目。86分にはGK藤嶋 栄介のパスをカットした鄭 大世が藤嶋の股を抜いてゴールに流し込み、今季二度目の５得点と大爆発した。

最後にマルティノスにゴールを奪われたが、５－３で勝利した町田は負けなしを７試合に伸ばした。山形は今季二度目の５失点、４連勝のあとに勝ちなしが４試合続いている。

［ 文：佐藤 円 ］","[ ピーター クラモフスキー監督 ]
残念な結果となってしまったと思います。全員が残念に思っていると思います。まず前半の内容はよく戦えていたと思いますし、良いフットボールができていて、自分たちがリードに値するものが出せていたと思います。その中で相手も対応に苦しんでいましたし、２点決めることができました。

後半は自分たちの戦い方から少し離れた形になってしまったと思いますし、20分ぐらい苦しんだ時間帯があったと思います。その中で失点してしまったと思いますし、そういったところはまた確認していかなければいけないと思います。もちろん残念なところでしたけれども、選手たちは最後までひっくり返そうと懸命に戦ってくれて、また最後に得点を奪うことができましたけれども、ここまでのダメージが大きく、届かなかったと思います。","[ ランコ ポポヴィッチ監督 ]
終わってみれば結果を出すことができて良かったのですが、事前に勝利を分けるポイントとして挙げていたデュエルや球際の勝負で負けないようにと選手たちには話してきた中で、前半はデュエルの部分で相手を上回ることができませんでした。また相手のチャンスは少なかったですが、その中で２失点をした前半でした。前半のわれわれは少なく言っても５回はゴールを決めるチャンスがあって、決められなかったことがスコアに反映されました。決定機の場面でナーバスになっていたことが見て取れました。

後半は０－２というビハインドを背負っても、ボールを動かして、攻守において連動することは継続できていました。それができたことがこの結果をもたらしました。前半と後半の違いは、チャンスを決め切ったかどうかでした。最終的にこういう結果につながって満足はしていますし、勝利にふさわしいプレーをわれわれの選手たちは見せてくれました。

また、この試合から学ぶことも多かったです。サッカーにスイッチは存在せず、ボタンを押して、ここからやるぞということにはなりません。一瞬たりともスキを見せてはいけませんし、緩くなってしまうと、結果を得られないのがサッカーです。そういった意味で前半に良くなかったことは共有できましたし、その上で後半に臨めました。

また３点目を決めたあとも引いて守るのではなく、肝心なことは４点目、５点目を決めるということでした。そういう姿勢を見せることができたことも大きな収穫となりました。メディアの皆さんには、試合前に負けないためではなく、勝つために戦う試合を見せるということを話していましたが、実際に勝つために戦う試合をできました。"
明治安田生命Ｊ２リーグ　第41節,町田,大宮,0,0,1,"前節・山形戦を５－３で制した町田がホームに帰還する今節は、今季のホームラストマッチ。来季も町田を指揮することが発表されたランコ ポポヴィッチ監督や、チーム得点王の吉尾 海夏は、大宮戦を「今季の集大成」として位置づけている。

ランコ ポポヴィッチ監督体制１年目の昨季は、ボール奪取からのカウンターという武器を磨いてベースを構築。２年目の今季はボールを握って相手を崩すアプローチを肉付けし、「速攻と遅攻を使い分けられる」（平戸 太貴）チームになりつつある。ただ、シーズンも最終盤に突入すると、特にＪ２残留争いの渦中にあるチームを相手にした場合、「完全に圧倒する試合」（鄭 大世）で勝ち切れず、勝点を落としてきた。今節の大宮も残留争いを戦っているため、ゴール前での必死さが際立つ。そうした相手を攻略できるか。シーズン終盤の宿題をクリアするラストチャンスと言えそうだ。

一方の大宮は直近５試合を１分４敗と、Ｊ３降格圏の足音が近づいてきている。勝点１でも積み上げることが残留への道を切り拓く状況だが、痛恨の足踏みが続く。最近はボールを握って戦う方針を封印。［４－４－２］の３ラインを構築し、ボール奪取からのショートカウンターをベースとした戦い方に舵を切っている。最近の傾向を踏まえれば、おそらく町田にボールを握らせ、ボール奪取からのカウンター狙いで勝機を探るはずだ。あるいは霜田 正浩監督らしく、攻撃的なマインドを貫く戦い方にシフトすることもあるのだろうか。

５位フィニッシュを目指す町田と残留死守に燃える大宮。勝利に対する執念も、勝敗を左右する大きなポイントになりそうだ。

［ 文：郡司 聡 ］","お互いに無得点だった前半は町田がボールを掌握し、守備に重心を置く大宮がロングフィードからの打開を狙う展開で推移した。

大宮は12分、最終ラインからのロングボールを河田 篤秀が収めて黒川 淳史に落とすと、黒川がミドルシュート。しかし、得点には結びつかず。一方、町田はビルドアップからの前進で敵陣に進入し、アタッキングエリアでは積極的に仕掛けていく。36分、吉尾 海夏がドリブルでサイドを破って中島 裕希につなぎ、中島のパスを安井 拓也がダイレクトで合わせるも、安井のシュートは惜しくも左に外れた。

ゴールが欲しい両チームは、ハーフタイムに選手交代を実行。２枚代えをした町田は早速立ち上がりの47分、ドゥドゥがポスト直撃のシュートを放ち、大宮ゴールを脅かした。ハーフタイムに大宮の霜田 正浩監督が「我慢比べの試合だ。１点勝負！」と話したように、０－０で推移した試合は１点勝負の様相を呈していく。

大宮は63分、最終ラインからのクリアボールを受けた河田がロングシュートを放ち、町田ゴールを脅かす。対する町田は68分、ダイレクトパスの連続から最後はドゥドゥが絶好機。しかし、惜しくもゴールの枠を外れた。

０－０で迎えた最終盤は、Ｊ２残留に向けて勝点が欲しい大宮がチャンスを量産。79分には奥抜 侃志に絶好機が訪れるもGK福井 光輝に阻まれ、90＋１分にも馬渡 和彰が絶好機を迎えたが、シュートはゴールの枠を外れた。

結局、試合はそのまま０－０で終了し、ともに勝点１を分け合う結果に。町田が５位を堅持し、一方の大宮は勝点を『39』に乗せた。

［ 文：郡司 聡 ］","[ ランコ ポポヴィッチ監督 ]
全体的に満足できる試合でした。見ていただいたとおり、勝利をあきらめている選手はいなかったですし、勝利への執念を見せた試合になりました。お互いが勝点を取るために死力を尽くした戦いだったと思います。

前半はわれわれがボールを持っていましたが、ゴールに向かう動きや攻撃は相手にとって怖さを感じさせる攻撃をできていなかったですし、そこが前半で足りなかったことです。後半はよりゴールに向かっての攻撃をできましたが、決め切ることができませんでした。ファン・サポーターの皆さんにたくさんお越しいただいたので、勝利の喜びを分かち合えなかったことは残念ですが、サッカーの面白さが詰まっている試合だったと思います。途中で席を立って帰るファン・サポーターもいなかったと思います。","[ 霜田 正浩監督 ]
非常に良いゲームができましたが、勝点３を取れなかった。多くのサポーターと勝点３を持って一緒に帰りたかった中、それができなかったことが非常に悔しいし、申し訳ない。本当に勝ちたかったと思います。

－－「自分たちがやってきたことを放棄するつもりはないが、割り切りも必要」と試合前に話していた中で、今日の内容をどう振り返る？
僕らがずっとやってきたことができたかというと、まだまだ課題は多く、せっかく奪ったボールもパスミスで失うことが多かった。崩していこうという攻撃はできなかった。でも、守備ではプレスを掛け、相手に蹴らせてそれをはね返し、セカンドボールを回収してカウンターにつなげていくと。不細工、不格好でしたけど、今日は「相手陣地でサッカーをやろう。相手にプレッシャーを掛けて、相手にサッカーをやらせず、自分たちが相手のゴールに向かっていくサッカーを徹底しよう」と話して準備をしてきた。その意味では、キレイなサッカーはできませんでしたけど、相手のゴールに向かっていく気持ちは伝えられたゲームにはなったかなと思います。

－－後半は前へ出ていけるようになった一方、決定機を仕留め切れない反省も残ったが？
決定的なシーンは作れている。あとは向こうのGKがうまかったとか、そのシュートをちゃんと決めないといけないとか。あとで言うことは簡単だけど、相手のペナルティーエリア内には進入できている。クロスが少なかった反省はありますけど、１－０で勝てた可能性のあるゲームだったので、非常にもったいないと思っています。

－－ホームでの最終節に向けて、いま思うことは？
今日も本当に多くのサポーターが来てくれたし、ホームじゃないかなと思うくらいの声援をしてもらった。最後はホームで戦えるので、彼らと一緒に喜べるように、僕らは全力を尽くす、死力を尽くすだけです。"
明治安田生命Ｊ２リーグ　第42節,新潟,町田,0,2,3,"今季の最終節。６位の新潟は勝点１差で上回られている５位の町田をホームのデンカビッグスワンスタジアムに迎える。

すでにＪ１昇格がなくなった新潟は、１つでも上の順位で終えて、来季に良い流れをつなげることを目指している。「最終順位が６位になるか、５位になるかの戦いという意味でも、とても重要」とアルベルト監督。勝てばシンプルに順位を入れ替えられる。

その指揮官は、今季限りで新潟を離れることが決まっている。さらに２日にはロメロ フランクと大本 祐槻の契約満了も発表された。ロメロにとって、新潟ラストゲームは古巣・町田との対決となる。同じく古巣対決になる鈴木 孝司は現在９得点。前節に続いてゴールを決めれば、２ケタ得点に乗せられる。

アルベルト監督は2020年からの２シーズン、「ボールを保持して試合の主導権を握るサッカー」をブレることなく新潟に植えつけた。今季前半はそのサッカーで首位を走り続け、大きな注目も集めた。それにより、新潟のスタイルとしても知られるようになった。前節・琉球戦で最終ラインから流れるようなパスワークで相手のマークをはがし、最後に鈴木が仕留めたゴールは「この２年間で最も美しいゴール」と指揮官も称賛した。今節も新潟のスタイルを表現し、勝利で飾りたい。

町田に目を向けると、昨季新潟でプレーした鄭 大世が古巣対決。圧倒的なフィジカルの強さとゴールへの執念を見せ、昨季９得点をマークした。“情熱のストライカー”の凱旋は、試合をさらに白熱したものにしてくれそうだ。

さらにアルベルト監督は「最終節はサポーターにとってのフェスティバル。サプライズにご期待ください」とコメント。新潟を愛する指揮官は最後まで新潟サポーターを喜ばせる何かを準備しているようだ。

サッカーでも、真っ向勝負できる町田は最高の相手。激しくボールを奪いにくる町田と、それをかわして攻撃に出る新潟のスリリングな攻防に注目だ。デンカビッグスワンスタジアムで、“アルベルト・アルビ”の集大成を見届けよう。

［ 文：野本 桂子 ］","今季で新潟を去ることになったアルベルト監督は、この最終節に向けて「サプライズ」を準備すると予告。試合前日に今季限りでの現役引退を発表した田中 達也をスタメンに起用した。田中はキャプテンマークを巻き、今季初先発。そしてラストゲームが幕を開ける。

「勝点３のために、いま自分が持っている100％を出して、チームの力になりたい」と話していた田中は［４－２－３－１］の１トップに立つ。

序盤から町田は前線のドゥドゥと安井 拓也がハイプレスのスイッチを入れ、新潟はビルドアップに苦戦する。それでもボールを持てば前へとつなぎ、田中に点を取らせようと試みるが、チャンスになる手前でボールを奪われてしまう。０－０で進んだ32分、田中は三戸 舜介と交代。両チームの選手によって作られた花道を通って、田中はプロの舞台をあとにした。40分、町田のCKから失点。吉尾 海夏の折り返しを受けた髙江 麗央がダイレクトでペナルティーエリアへ入れると、佐野 海舟がゴールへと流し込む、デザインされたセットプレーでリードを許す。

後半開始から、田上 大地に代えて主将の堀米 悠斗を投入した新潟。右SB藤原 奏哉が仕掛けてクロスから得点を狙うが、形にはならない。すると68分、縦パスを奪われてつながれると、ゴール前をワンツーで崩されて最後はドゥドゥに決められ、点差が広がる。

まずは１点を返したい新潟はボールを動かしながらスキをうかがう。83分、三戸と島田 譲の連係から中央突破で鈴木 孝司がシュートを放つが、GK福井 光輝に止められる。

その後もスコアは動かせず、２－０でアウェイの町田が勝利し、試合終了。町田は５位、新潟は６位で今季を締めくくった。

［ 文：野本 桂子 ］","[ アルベルト監督 ]
町田さんは素晴らしい監督が指揮する、Ｊ２で偉大なクラブの１つです。われわれの入りが悪かったのもありますし、町田さんが質の高いプレスを掛けてきて、うまく打開できませんでした。その中で運にも恵まれたセットプレーで、点を取られた前半でした。後半、うまく立て直して良い形でプレーした時間は多かったと思います。チャンスはあまり作れませんでしたが、試合は支配できていたと思います。運と決定力の高さで２点目を入れられてしまったのはとても残念でした。

偉大な監督のもとで成熟した町田と対戦するのはいつでも難しい。そして、われわれを上回る形で良い試合をしていたことが、試合結果につながっているのではないでしょうか。いすれにせよ、私は私の選手たちのプレーを誇りに思っています。全スタッフ、クラブに関わるすべての方に感謝しています。そしてこの街が、ふさわしい形で今後多くの成功を収めることを心から祈っています。","[ ランコ ポポヴィッチ監督 ]
私が期待していたとおりの試合になりました。試合前に選手たちへ話したことは、良いものを見せ続けられていたとしても、それは一瞬で崩れ落ちるものだということです。だからこそ、今季ここまで積み上げてきたこと、成長してきたことを証明しようと。また町田のユニフォームを着て、町田のエンブレムをつけて試合に出る以上、すべてを出し切る試合をしようと伝えました。

今日は多くのサポーターの方々も駆けつけた中で、彼らの力も借りて、選手たちはわれわれが持っているものを出してくれました。非常によくやってくれました。試合全体を振り返ってもよくやってくれたと思います。今季の集大成となる試合で私が何を求めてきたのか。そして何が成長したのか。それらを見せることができましたし、それが今日のすべてだったと言えるでしょう。"
