Round,Hteam,Ateam,Hscore,Ascore,WorL,Preview,Review,H_comment,A_comment
明治安田生命Ｊ２リーグ　第42節,琉球,町田,0,1,3,"コロナ禍によりイレギュラーで実施された明治安田Ｊ２も今節、最終戦を迎える。

「今年は本当にいろんなことがあった異例のシーズンの中でも、僕らを応援してくれて雰囲気を作ってくれた。支えてくれた方々のためにも良い形で締めくくりたい」。樋口 靖洋監督は最終節に向けて、勝利で恩返ししたいと意気込んだ。

前節、水戸に２－０で勝利を収めた琉球。相手に支配される時間帯はあったものの、守備の一体感が粘り強さを生み出すと、攻守の切り替えを鮮明に相手の裏を突くパス交換で動かす。河合 秀人と池田 廉のゴールが生まれ、昨季を超える勝点50を達成した。２連勝とともに２試合連続無失点を果たしており、「ここにきて積み上げてきたことが表現できるようなってきた」と指揮官は手ごたえをつかんでいる。

迎える最終節。琉球はホームに町田を迎える。町田は前節で磐田と対戦し、幸先よく２点を奪うもその後に３失点を喫して敗戦。３連勝とはならなかった。ただランコ ポポヴィッチ監督は「ボールを奪ってからゴールに向かうという迫力を出せていた」と攻撃を評価。好感触を得て最終節へと臨む。

その町田に琉球は前回対戦で２－４で敗れている。「勢いに乗せたら自分たちをはるかにしのぐ攻撃力を持っているチーム。相手に自由を与えず、序盤に主導権を譲らないようにしたい」と李 栄直。「前線にシュートがうまい選手がいる印象」と話す田口 潤人は横浜FMユースの後輩で、磐田戦でもゴールを決めた吉尾 海夏に警戒心を強める。

上質な攻撃を示すチーム同士のせめぎ合いが想定される中、「勝つことで見に来てくれるサポーターの方々の心が晴れるよう、勇気を与えるような試合ができるよう頑張ります」と琉球のキャプテン・上里 一将は最終節を勝利で終えるべく気持ちを高める。

［ 文：仲本 兼進 ］","今季最終戦となる今節。14位の琉球はホームに19位・町田を迎え入れた。

琉球のスタメンは前節・水戸戦から１人変更し、上里 一将が先発に。２試合連続ゴール中の池田 廉を頂点に置いた［４－２－３－１］を敷いた。対する町田は、開幕から連続先発出場を続けていた奥山 政幸がメンバー外となり、酒井 隆介が８試合ぶりに先発。［４－４－１－１］で臨んだ。

ファーストシュートは琉球。敵陣で小気味よくボールを回し、ペナルティーエリア外右から風間 宏矢が狙う。しかし枠を捉え切れず、チャンスを生かせなかった。

ディフェンスラインを高く維持し、攻撃姿勢を保つ両チーム。中盤での攻守の切り替えが目まぐるしく、一進一退の攻防が続いたが、16分、町田が均衡を破る。琉球のCB知念 哲矢の縦パスをカットした吉尾 海夏が右サイドでドリブル突破。カットインからミドルで狙った左足シュートがゴール左スミに吸い込まれ、アウェイが先制する。

前半の飲水タイム明け。町田はバイタルエリアを攻める安藤 瑞季からボールを受けた平戸 太貴がエリア内でシュートを放つが、コースが甘く琉球のGK田口 潤人がキャッチしマイボールに。下からつなぐ琉球は両サイドから攻め立て、右SB田中 恵太がペナルティーエリア外から積極的に狙うも、これはポスト直撃に終わる。続けて、沼田 圭悟の左クロスに風間 宏矢がエリア内中央でシュートを放ったが、これはコントロールできず。前半終了間際にも田中の右クロスに小泉 佳穂が体勢を崩しながらも頭で狙ったが、決め切れず。このまま、町田の１点リードで前半を折り返した。

後半開始早々、町田がハイプレスからボールを奪い敵陣へ入り込むと、ジョン チュングンが先手必勝を狙ったミドルを放つが、これは枠の外。なおも攻める町田はセットプレーからチャンスを作るも、琉球の粘り強い守備にゴールをこじ開けられない。

一方、風上に立つ琉球は徐々にボールを支配するようになると、途中出場の上原 慎也をターゲットにクロスボールを再三供給し、アグレッシブに攻める。しかしゴール前で堅いブロックを敷く町田の粘りに決定機を作れず、つなぎのミスで相手にボールを奪われカウンターを受けるなど、最後までリズムを作り切れなかった。

結局、町田が最終節を白星で締め、19位でフィニッシュ。琉球は昨季の年間順位から２つ下げ、16位で今季を終えた。

［ 文：仲本 兼進 ］","[ 樋口 靖洋監督 ]
90分終わって０－１という結果。ホーム最終戦を飾れず、残念な結果として受け止めなければいけません。ただゲームのほうは非常に集中して戦えたと思っています。守備面でも非常にコンパクトにしながら、失点したシーン以外はほぼ（攻撃で）やられていないですし、やらせなかった。それから、ボールを握ったところでもボールを動かすことがかなりできました。しかし今日はちょっとパスミスの部分がいくつかあって、少しリズムが作り切れなかったところがありました。それでも多くのチャンスを作ってゴールに向かうシーンが作れていたと思っています。ただ、それが得点につながっていないというのがある意味今季の負けた試合の象徴かなと。今季、得点ゼロで負けた試合が多かったと思います。こういう部分をやっぱり来季は改善していかないといけないなと、あらためて思った試合でした。寒い中、多くのみなさまに来ていただいて感謝申し上げます。１年間ありがとうございました。","[ ランコ ポポヴィッチ監督 ]
この結果に関しては、満足しています。シーズン最後の試合をしっかりと勝利で締めくくろうという強い気持ちを感じました。締まった内容のゲームができましたし、攻守においてタフに戦えて非常に良かったです。われわれが集団で戦うという姿を見せ続けられたことに手ごたえを感じています。選手たちにはよくやったと伝えたいですし、気持ちを見せて最後まで戦い切ってくれました。

－－集大成のゲームとなる最終節。１年間積み上げてきたものを見せられたという観点では、どう評価されていますか？
シーズンの終盤の時期というのは来季のことや、今後のことが頭をよぎって集中できない時期ですが、試合前、選手たちには今日が最終戦ではなく、開幕戦のつもりで戦ってくれと話しました。ここまでやってきたことをあらゆる局面で表現できましたし、自分たちがやってきた仕事へのリスペクトを感じさせる内容でした。サポーターの皆さんにも、ここまで応援していただいたことへの恩返しをするという意味でも、最後の試合で結果を残せたことをうれしく思います。"
明治安田生命Ｊ２リーグ　第1節,町田,山形,1,1,1,"２年目の上積みが勝負を分ける――。ランコ ポポヴィッチ体制２年目の町田と、石丸 清隆体制２年目の山形が激突する開幕戦は、まさにそんな一戦になるだろう。

ホームの町田は今オフ、近年にはない充実した陣容を整備。プレシーズンのキャンプでは、土台作りの１年目で構築したプレッシングからのショートカウンタースタイルをさらにブラッシュアップしてきた。昨季軸としてフル稼働した佐野 海舟や髙江 麗央ら既存戦力に加え、長谷川 アーリアジャスールや太田 修介ら新たな力が注入されたことで、「軸となってきた選手たちの力をさらに引き上げてくれている」とランコ ポポヴィッチ監督は自負する。また、岡田 優希は「１試合を通して、シンクロする回数が確実に増えている」と話すほど、チームの進化に手ごたえをつかんでいる。

一方の山形はセットプレーでの得点力を支えてきた中村 駿や、渡邊 凌磨らはチームを離れたが、得点源のヴィニシウス アラウージョが残留し、実力者の國分 伸太郎や堀米 勇輝を補強。特に個ではがせる堀米は愛媛や京都で石丸監督の薫陶を受けてきた存在だけに、チームに大きなプラスαをもたらしそうだ。もちろん、山形はプレシーズンのキャンプを通じて、Ｊ２では珍しいボール保持を前提としたチームスタイルに磨きをかけてきたはず。町田のプレッシングをはがせるだけのクオリティーを発揮できるかは、山形にとって、１つの焦点になるだろう。

ベースのチーム戦術に磨きをかけながら、既存戦力と新戦力の融合でパワーアップしたと自負する町田がホームでの開幕戦を制するのか。あるいは、山形が町田アウェイ４戦無敗＋無失点という好データを追い風に勝利で好スタートを切るのか。いずれにせよ、２年目の飛躍を期す両チームが対峙する一戦は、白熱したバトルが期待できそうだ。

［ 文：郡司 聡 ］","開幕戦特有の硬さなのか。特に前半はピッチの至るところでのつぶし合いが続き、ゴール前での攻防がやや少ない展開となった。それでも、コンビネーションを駆使してゴール前に迫る山形。33分には左サイドでボールをつなぎ、ボックス内まで進入したが、町田の体を張ったディフェンスの前に決定的なシュートまで持ち込めない。一方の町田は39分、吉尾 海夏からのサイドチェンジを受けた岡田 優希がカットインから右足のシュート。鋭いシュートは山形ゴールを強襲したが、惜しくも枠外へ。こうして試合は前半をスコアレスで終えた。

ともに選手交代なしで迎えた後半。序盤の56分にスコアが動く。セットプレー崩れの展開からヴィニシウス アラウージョのクロスが水本 裕貴のオウンゴールを誘発。アウェイの山形が先制した。

１点を追う町田は61分、長谷川 アーリアジャスールに代えて太田 修介を投入。左サイドハーフの岡田をセンターFWに配置転換し、途中出場の太田は左サイドハーフのポジションに入った。さらに町田は73分に２枚代え。選手交代で活路を見いだそうとする中、終盤にスコアを動かした。

86分、平戸 太貴のFKを深津 康太が頭で合わせてタイスコアに持ち込む。その後はホームの町田が敵陣に押し込み、逆転を狙ったが勝ち越しゴールは奪えず。最終的に１－１で勝点１を分け合う試合を、山形の石丸 清隆監督は「開幕戦らしいクローズな硬い試合だった」と振り返っていた。

［ 文：郡司 聡 ］","[ ランコ ポポヴィッチ監督 ]
開幕戦というのは独特な試合になることは常々話してきたことですし、開幕戦はフタを開けてみないと分からない部分があります。必要以上に力が入ることも、ナーバスになることもあります。ただわれわれの選手たちは、立ち上がりからナーバスな部分を見せずに、相手を押し込むことができました。その一方で後半の時間帯ではナーバスになる時間帯もありました。前半にあった２、３回のシュートチャンスを決め切れず、そのチャンスを決めることができれば、また違った試合展開になったと思います。

後半に関して言えば、イージーなミスやトラップミス、パスミスが増えましたし、そこで精度の高いパスを出せていれば、もっとチャンスになっていたと思います。また相手のプレッシャーがない場面でのミスが増えました。だからといって、決定機を作られたわけではなかったですし、ほぼ危ない状況もない中で、不思議なことにスコアは０－１、ビハインドを背負うことになりました。それでも、選手たちは下を向くことなく、勝つという強い気持ちを持っていたことが同点ゴールにつながりました。

引き分けという結果でしたが、選手たちのハードワークや強い思いが勝点１に結びつきました。昨季も不運な失点がありましたが、そこを少なくしていくことも大事なことですし、こうして今季も不用意な失点が起こりました。今後に向けて不用意な失点をなくし、修正していけるところは修正していきたいです。その精度を上げていかないと勝点は取れませんから。","[ 石丸 清隆監督 ]
まず、こうやって無事に開幕することができたというのは喜ばしいことかなと思います。僕たちのサポーターが来られないというのは残念でしたけど、サッカーができたことに感謝したいと思います。

ゲームのほうは、いろいろプランはありましたけど、開幕戦ということもあってかなり硬い試合になるだろうなと思いましたけど、どちらかというと自分たちのやりたいことは、自分たちのほうが前半はできなかったなというのが印象です。ポジショニングも悪かったですし、自分たちからつかまりにいってるイメージがあったので、相手としてはすごい守りやすかったなという部分がある印象です。その中で、取られ方が悪くてカウンターを食らうとか、前半はよくゼロで戻ってきたなという印象があります。

少しだけ後半はポジションを修正しましたけども、ゴール前まで詰め入るシーンはなかなか。イメージとは違うような形では持っていきましたけど、自分たちのやりたいことはあまりできなかったという印象です。そういった意味では、町田さんのゲームだったんじゃないかなと思います。"
明治安田生命Ｊ２リーグ　第2節,磐田,町田,1,3,3,"昨季は磐田のホーム最終戦。今季は磐田のホーム開幕戦で激突する両チーム。互いに勝利を逃している開幕戦の結果を踏まえても、手にしたい結果は同じだろう。

開幕戦で琉球と対戦した磐田。ほとんどの時間帯でボールを保持して合計20本のシュートを放つが、結果は無得点。また試合開始１分の失点が痛恨となり、先行き不安になる黒星スタートとなった。

守備を固める相手を崩し切れないという昨季から抱える課題は、いまだ解消できていない。サイドで数的優位を作れたタイミングでは敵陣深いエリアから決定機を作ったが、その回数と質を高めていくことが重要だ。

もっとも、町田がハイプレスを得意とするチームということを踏まえれば、今節はビルドアップの安定感が欠かせない。「タッチ数を少なく、（ボールを持っていない）オフのプレーヤーがタイミングよくサポートする。前向きなプレーヤーをうまく使えれば、テンポは上がる」と鈴木 政一監督はポイントを明かす。最終ラインからパスコースの出口になることが多い遠藤 保仁、山本 康裕のダブルボランチには、機転の利いたサポートが求められるだろう。

対する町田の開幕戦は、ホームで山形と対戦。相手に押し込まれる時間は長かったが、終盤にセットプレーから深津 康太の得点で同点に。価値あるドローに持ち込んだ。中央にボールを通させない強固な ［４－４－２］のブロックを構築し、しぶとさが光っていた。山形と同様にボール保持を目指す磐田との一戦でも継続が求められる。

特に町田にとっては、数少ないチャンスを生かすことが勝利へのカギを握る。前線のアグレッシブなプレスとショートカウンターの機能性を高めて活路を見いだしたい。やることが明確なぶん、町田にも十分に勝機はあるだろう。

［ 文：森 亮太 ］","自分たちが最も得意とするハイプレスを立ち上がりから仕掛ける町田。対する磐田も、理想とする後方からショートパスをつなぐビルドアップで応戦。ただ町田のアグレッシブな守備が上回り、見事に相手のビルドアップを封鎖。９分、そのハイプレスから磐田にバックパスを誘発させて、GK八田 直樹がキックミス。そのミスを逃さなかった中島 裕希がゴールに流し込んだ。

前節・琉球戦と同様に前半序盤に失点し、劣勢な状況に立たされた磐田だったが、15分過ぎからボール回しにも落ち着きが生まれる。30分、的確なサポートでボールを引き出した遠藤 保仁から大森 晃太郎にボールが渡ると、ドリブルでスピードアップ。大森がルキアンに展開したところからピンポイントクロスを上げて、最後は松本 昌也が決めて同点にする。ただその２分後には、中島のクロスを平戸 太貴が頭で合わせて、再び町田に勝ち越しを許した磐田。町田の狙いがピタリとはまった前半は、町田が１点リードで折り返す。

磐田が攻勢を強めた後半。特に55分からは町田の最終ラインも下がり始め、磐田が敵陣に押し込む時間が続く。ただ、ルキアンや松本に訪れたシュートチャンスも前節同様に決め切れない。すると反対に73分、町田が華麗にワンタッチでボールをつなぐ崩しを見せる。最後は、63分にピッチに入った長谷川 アーリアジャスールが決めてダメ押し。

リードを広げられた磐田は、CBの大井 健太郎を最前線に上げてパワープレーを実行。しかし、それも実ることがないまま、タイムアップ。

最後まで組織としての完成度の差を見せつけた町田。勝者にふさわしいサッカーで今季初勝利を手にした。一方で2018年以来の開幕連敗スタートとなった磐田。厳しい現実を突きつけられることとなった。

［ 文：森 亮太 ］","[ 鈴木 政一監督 ]
守備のところでは、ボールへの寄せが甘かったとき、（ボールへの寄せが）厳しいとき、オフのマーキングのポジションなどがチグハグしていた。特に前半多くあったのは、ボールホルダーへの規制が甘すぎて、（相手に）動かれてしまう。そこでリズムが出ない部分があった。そこを修正してリズムを取り戻すことができたと思ったが、そこら辺が失点に結びついたと思っている。得点に関しては、ボールホルダーの状況でいつも言っているように、人も動いてボールも動かす。人が動く部分で言うと、町田と比べてもゴール前での動きは少なかった。もっとシュート数が増えなければいけないと思っている。

－－町田がハイプレスを仕掛けてきた。そこをどのように解消したかったか？
ボランチの遠藤（保仁）、山本（康裕）をもう少しうまく使いたかったが、そこが少なかったですよね。そこを使うことでサイドをもっと起点にできる。相手のプレススピードを判断した中で、精度の高いボールを動かす能力がないと苦しいと思っている。","[ ランコ ポポヴィッチ監督 ]
今日の試合に臨むにあたって、われわれが大事にしていたことはチームで戦うということです。ジュビロ磐田という強い相手に対して、自分たちの力を見せられたことがうれしいですし、選手たちが素晴らしい働きをしてくれました。また今日の試合でも日々成長している姿をお見せすることができたと思います。

－－磐田には昨季のアウェイでの試合（第41節／２●３）で悔しい負け方をした。その磐田に勝利できたことはチームにとって、大きな自信になりますか？
われわれのチームにとって、この結果は大きな自信になりました。また、われわれがここまで積み上げてきたことが間違った方向に行っていないというのも示すことができました。どんなに強い相手との対戦でも、チームとしてまとまって戦えば、結果を出せるということを証明できた試合です。また、もう１つ良かったことは、途中から出場した選手がさらにチームのクオリティーを引き上げてくれました。それも大きかったです。チームのために戦うことで、選手はより評価されるということを言い続けてきて、途中から出た選手が、私が常々言っていることを実践してくれました。"
