Round,Hteam,Ateam,Hscore,Ascore,WorL,Preview,Review,H_comment,A_comment
明治安田生命Ｊ２リーグ　第1節,町田,甲府,0,0,1,"新たにランコ ポポヴィッチ監督が就任した町田は、2016年のＪ２復帰以降、初めて新体制でＪ２開幕戦を迎えることになった。奥山 政幸は言う。

「いよいよ始まるなと。ワクワクしています」

2011年以来の町田監督復帰を果たしたランコ ポポヴィッチ監督が率いる“新生・町田”は、地上戦でのパスワークを基軸としたチームスタイル。より直線的にゴールを目指した前体制とは異なるため、町田はプレシーズンからチームスタイルの転換に取り組んできた。そのお披露目の舞台でもあるホームでの開幕戦を前に平戸 太貴は「ワクワクするサッカーを見せたい」と言葉に力を込めた。

対する敵地に乗り込む甲府は、伊藤 彰監督が就任２年目を迎え、“継続路線”でＪ１復帰を狙う。プレシーズンでは３バックと４バックを併用し、柔軟に戦えるチームにしようと、強化を図ってきた。「相手によって戦い方を変えられることも強さですし、変えたことで勝てるようなチームにしていきたい」と伊藤監督は言う。より柔軟性を身につけつつある甲府は、“曲者”と言えそうだ。

なお、町田と甲府は２月の宮崎キャンプで練習試合を実施。主力組が対戦した時間帯は甲府が押し込まれながらも一発を仕留める力で町田を苦しめた。開幕戦は約２週間ぶりの“リターンマッチ”となる。

その“前哨戦”のあと、町田のランコ ポポヴィッチ監督は「開幕戦の結果は見てのお楽しみ」と不敵に語り、対する甲府の伊藤監督は「また違った試合になる」と警戒心を隠さなかった。

町田の雪辱か。甲府の返り討ちか。“白星スタート”をもくろむ両者の激突は、熱戦必至だ。

［ 文：郡司 聡 ］","開幕約２週間前の２月８日、トレーニングマッチを戦っていた町田と甲府。まだお互いに対戦した肌感覚が残る中で激突したオープニングマッチは、前述の試合後、甲府の伊藤 彰監督が「開幕戦は堅い試合になるかもしれない」と話していたとおりの展開となった。

90分を通じたビッグチャンスは21分。中盤で町田がボールロストした展開から甲府がカウンターを仕掛け、ドゥドゥのパスを受けた泉澤 仁がGK秋元 陽太との１対１を迎えた。しかし、甲府にとっての絶好機は「自分の間合いに持ち込むことができた」という秋元がブロック。町田デビューを飾った新戦力がファインセーブで阻止し、アウェイの甲府がビッグチャンスを逃した。

一方、町田の決定機は60分。深津 康太の縦パスをステファンが落とし、ステファンからのパスを受けた吉尾 海夏が平戸 太貴へ展開すると、平戸がファーサイドにクロスボールを供給。マソビッチのヘディングシュートはブロックに入った藤田 優人のハンドにも見えたが、主審の笛は鳴らず。ゴールにはつながらなかった。

甲府は61分の新井 涼平投入を機に、システムを［４－２－３－１］から［３－４－２－１］へ変更していたが、絶好機を作れず。一方の町田もドリアン バブンスキーや中島 裕希を投入して１点を狙いにいったものの、お互いに最後までゴールを割ることはできなかった。

試合はそのままスコアレスドローで終了。開幕戦特有の硬さもあったのか、お互いに慎重なゲーム運びが目立った町田と甲府のオープニングマッチは、「最低限の勝点１」（甲府・伊藤監督）を得る結果となった。

［ 文：郡司 聡 ］","[ ランコ ポポヴィッチ監督 ]
皆さん、こんにちは。チームが始動して約２カ月弱経ちましたが、この時期にしては全体的によくやれていました。良い試合だったと感じています。私が試合後に満足したと話をするのは珍しいですし、少ないのですが、今日に関しては満足できた試合だと実感しています。

－－満足されたという話でしたが、そう思えたポイントは？
チームとして戦えたということがポイントでした。試合のホイッスルが鳴ってから、終わりのホイッスルが鳴るまで全員で戦えていました。最初から最後まで何をやりたいのか、チームで共有できて、それが分かっているからこそ同じイメージを共有して、同じ絵を描いてチームとして戦えました。２カ月弱という短い時間を考えれば、この時期にチーム力を見せられて満足しています。私自身、選手たちに驚かされました。チームとして戦えたことに満足しています。私もここからだと思っています。もっと満足してもらう試合をするためには、毎日の積み重ねを怠ってはいけません。ここから日々努力して、そしてプレーの質、クオリティーを上げていく試合をしたいです。","[ 伊藤 彰監督 ]
開幕戦に2000人近くのファン・サポーターに来ていただいて、ちょっと堅いゲームになりましたが、応援してくださってありがとうございます。前半から堅い入りでしたが、お互いにしっかりゴール前で守りながらやっていた印象です。後半何度かチャンスがありましたが、それを決め切れていれば違っていたと思います。前半でも（泉澤）仁のシュートが１本決まっていればというのもあるが、お互いに同じような感覚を持っているんじゃないかと思います。

－－硬さがあってもう少しアグレッシブにできたという話があったが、ビルドアップのときに山本 英臣選手が下がるのは監督からの指示だったのか、選手が自主的に判断してのプレーでしたか？
こちらの指示です。相手は縦関係の２トップみたいな感じになっていて、ツーセンターで切りながら行きたいというのがあったが、プレッシャーを受けていた。良い状態でボールを持って配球ができていなかったので、ボランチを１枚下げながら、前半はそこで形を作りながら良い状態でボールを持たせたかった。"
明治安田生命Ｊ２リーグ　第2節,東京Ｖ,町田,1,1,1,"開幕戦を終えた段階でリーグが中断し、新たに日程を組み直したことで第２節での対戦となった“東京クラシック”。 ホームの東京Ｖは開幕の徳島戦に０－３で敗れ、約４カ月もの間を順位表の一番下で過ごした。アウェイの町田は甲府を相手にスコアレスドローに終わり、順位表の真ん中にあたる11位でこのリーグ再開を迎える。

チーム練習再開後の、ここまでの両チームは対照的だ。練習場に報道陣を受け入れていないのは同じだが、トレーニングマッチの扱い方が両極端なのだ。町田は13日に浦和、17日に川崎Ｆ、20日に鹿島と戦い、浦和に２－１で勝利（30分×４本）、川崎Ｆに０－５と大敗（45分×３本）、鹿島には０－１で敗れているが（45分×４本）、川崎Ｆ戦以外はYouTubeでの配信が行われた。おかげで東京Ｖにとっては、この再開初戦の町田の先発11人と、どんなサッカーをしてくるのかスカウティングが捗るだろう。

一方で東京Ｖも３試合行ったのは確かだが、その相手と出場メンバー、結果は非公開。本来、東京Ｖはメディアに対して比較的オープンなクラブで、取材もリモートであれば積極的に受けているが、これに関しては「できればその日に練習試合を行ったことも伏せてほしい」と異例の秘密主義を貫いている。そのため番記者にもメンバーが読めないばかりか、「徳島戦の反省も踏まえ、いろんなフォーメーションを試して新しいバリエーションが増えた」という佐藤 優平の言葉がどういう事象を指しているのかまったく分からない。

もちろんトレーニングマッチの情報については相手チームの意向もあるし、公開するのが良くて非公開が悪いといったものでもない。ただ、図らずもフルオープンvsフルガードの戦いとなった“東京クラシック”がどう転ぶのか、それも１つの見どころになるのではないか。

特に東京Ｖが面白い。Ｊ１昇格のために現実的なサッカーを志向するチームが多いＪ２にあって、永井 秀樹監督の下で「８割以上ボールを支配し、圧倒して圧勝する」理想に邁進する姿と、その秘密主義が相まって、何かとんでもないことを企んでいるのではないかという不安と期待が入り混じる。思えば開幕戦でもＪ１通算得点王の大久保 嘉人を中盤で起用するサプライズを見せたが、それを上回るものを準備しているかもしれない。

「試合ができることが楽しみだし、自分たちのサッカーが表現できることが楽しみ」と佐藤。いったいどんなサッカーを表現するのか、注目の“東京クラシック”だ。

［ 文：芥川 和久 ］","町田の先発は準備期間の練習試合配信から予想されたとおり、開幕戦からマソビッチとステファンに替わってジョン チュングン、安藤 瑞季が起用された。一方、練習も練習試合もすべて非公開としていた東京Ｖは、開幕戦から５人が入れ替わった。大久保 嘉人、レアンドロはベンチからも外れ、若狭 大志、平 智広、端戸 仁、井出 遥也、井上 潮音が初先発。リモートマッチ特有の静寂の中、DAZNで見守る東京Ｖのファン・サポーターにとっては期待と不安の入り混じるキックオフとなった。

試合は早い時間に動いた。３分、町田が自陣から大きなサイドチェンジをジョン チュングンに通す。サポートに寄った平戸 太貴がボールを受けたとき、東京Ｖの右サイドは完全に数的不利の状況。平戸は冷静に、外を回ったジョン チュングンをおとりに使い、狙い澄まして右足を一閃。見事なコントロールショットがゴール右上スミに吸い込まれた。

先制したことでアウェイチームは自陣に引き、中央を固めてカウンターを狙う得意の展開に。東京Ｖは圧倒的にボール支配率で上回るものの、ペナルティーエリア内の場面をなかなか作り出すことができない。しかし町田にとってもじれる展開なのは間違いなく、前半途中の飲水タイムには「中に入ってこられなきゃ何の問題もないぞ！」という深津 康太の大きな声が響いた。前半の東京Ｖのボール支配率は77％にも達したが、決定機を作らせることなく町田は守り切った。

後半開始から東京Ｖは２枚の交代カードを切る。昨夏の大ケガから復帰した藤本 寛也と、大卒ルーキーのスピードスター山下 諒也をピッチに送ると、51分に早速その２人が相手CKのカウンターから決定機を演出するが、最後の端戸のフィニッシュは枠を外れた。その後も東京Ｖが圧倒的にボールを握るものの、得点には至らない。そのまま試合終了かと思われた後半アディショナルタイム、端戸のポストプレーからボールを受けてペナルティーエリア内に進入した山下が倒されPKを獲得。これを藤本が沈めて、“東京クラシック”は勝点１ずつを分け合う結果となった。

［ 文：芥川 和久 ］","[ 永井 秀樹監督 ]
出合い頭に失点してしまい、われわれのプランからすれば想定外でしたが、選手たちが自分たちのサッカーをやり通してくれた。その姿勢を90分間見せてくれた。最後にPKで、なんとか勝点１を取れたことは良かったが、われわれはボールを保持して、その先というところが、昨年から引き続きトライしているところで、そこの精度、崩しのところを引き続き高めていきたい。

－－攻撃の軸であった大久保 嘉人選手、レアンドロ選手がメンバー外だったのは？
コンディションの問題です。そんなにひどくはないと思います。なるべく早めに帰ってきてほしいと思います。

－－リモートマッチの感想は？
非常に不思議な感じの試合で、選手のモチベーションなどいろいろ心配していましたが、選手は前向きにやってくれたのはすごく良かったなと思います。われわれの仕事からすれば、非常に声が通りますし、指示が直接伝わるのでやりやすさも感じました。でもやはりＪリーグというのはファン・サポーターの方に見ていただいて試合するのが選手にとって一番良い形なのかなと感じながら今日はやりました。","[ ランコ ポポヴィッチ監督 ]
試合の入りは素晴らしい立ち上がりでした。ゴールシーンに関してはトレーニングを積んできた形です。ただそれ以外の攻撃のシーンに関しては、やってきたことを出せれば良かったですが、今日はそこが足りませんでした。もしかしたら選手たちはゴールシーンがあまりにも美しかったので、もうゴールを取らなくてもいいと思ったのかもしれません。

ゲームプランとしては、相手を呼び込んで相手の背後のスペースをカウンターで突くという形だったのですが、ボールを奪う部分はうまくいったものの、奪ったあとの質が伴わなかったですし、相手にとって危険な攻撃をすることがなかなかできなかった試合です。まだまだ精度や状況判断の部分は成長していかないといけないと感じています。でも90分間を通して、相手にビッグチャンスを作らせなかった。決定的な場面がほとんどなかったことは良かった点だと思います。

そして非常に残念なことは背後のスペースが十分に空いていましたし、良いタイミングで裏のスペースを使うことができれば、もっとゴールシーンが増えたんじゃないかなと思っています。そこをうまく突くことができませんでしたし、質が伴わなかったことは次の試合に向けての修正点になります。

最後の失点の場面は集中力の欠如と言わざるを得ないですし、相手にスキを見せて集中力を欠いてしまったことは残念でした。ただ忘れてはならないことは１－０の場面で安藤（瑞季）のチャンスがありましたが、私たちにも先に追加点を取るチャンスがあったので、そこを先に生かすこと、チャンスを点につなげることが大事だと思います。ただ選手たちは規律を持ってオーガナイズしてしっかりと戦ってくれました。その点に関しては満足しています。"
明治安田生命Ｊ２リーグ　第3節,町田,山形,0,0,1,"前節の東京Ｖ戦を１－１で引き分けた町田がホームに帰還する今節。町田ＧＩＯＮスタジアムに迎撃する相手は2016年のＪ２復帰以降、４勝３分１敗と比較的相性の良い山形である。

山形はどちらかと言えば、ボールを握ることを志向するチーム。前節の町田はボールを握ることを大前提としている東京Ｖに圧倒的にボールを支配されただけに、思考が近い山形相手に前節の教訓は生かせるはずだ。前節は７割以上もボールを支配されたことで反撃に転じる回数・時間帯が少なく、先制しながらも最後まで守備が持ちこたえることはできなかった。山形戦に向けて、今季のチーム初ゴールを決めた平戸 太貴は「もう少し自分たちから奪いにいく守備をして、奪ったボールを失わずに攻めにつなげること」をポイントに挙げる。

対する山形の前節は栃木のパワープレーにも屈せず、耐久力のある守備で１点差を逃げ切っている。山形としては前節の反省を踏まえ、もう少し町田を押し込む展開を望むはずだ。攻める山形、守る町田という構図も想定される中、スキを見せたほうが苦しい試合展開を強いられるに違いない。

今節も前節に続いてのリモートマッチとなる。スタジアムに観衆はいなくても、平戸は「サポーターの応援してくれる声は選手たちに届いている」と話す。今季初勝利を目指す町田と初の連勝を狙う山形が激突するリモートマッチ。DAZNを通じて熱視線を送るにふさわしい一戦だ。

［ 文：郡司 聡 ］","ボールをつなぎながら進撃を試み、渡邊 凌磨と末吉 塁による右サイドコンビが良いアクセントになって攻め込む山形。それに対して町田はコンパクトな３ラインを構築して応戦し、奪ったボールをゴール前まで運ぶ構図で試合は推移したが、前半はお互いにシュートまで持ち込むシーンが少ない展開となった。

ところが静かな前半が後半になると変化が生じる。０－０で迎えたハーフタイム、末吉に代えて加藤 大樹を投入した山形がセットプレーからチャンスを創出すると、48分、大槻 周平のシュートが右ポストを直撃。ゴールに肉薄した山形は52分にもFKから渡邊がシュートチャンスを作るなど、アウェイチームが町田を押し込んでいく。

後半立ち上がり、相手の攻勢をしのいだ町田はセカンドボールを回収し、センターFWの安藤 瑞季が背後を突く形から次第に相手ゴールに迫った。しかし、安藤のシュートチャンスは相手のブロックに阻止される形でチャンスに結びつかずにいると、71分に交代出場の中村 充孝がチャンスを創出。町田は決定的なシュートを浴びたが、GK秋元 陽太のビッグセーブで難を逃れた。

チャンスの数では山形に分がある試合は、両チームとも終盤に“２枚代え”を敢行。特に山形はシステムを［４－３－３］に変えて１点をもぎ取りにいく。こうして後半のアディショナルタイムは４分と表示される中、土壇場の90＋５分。平戸 太貴のCKから町田は得点の機運が高まったものの、クリアボールを拾った髙江 麗央のミドルシュートが枠を外れ、スコアレスのまま試合終了。ランコ ポポヴィッチ監督が「非常にまとまった堅いチーム」と評した山形の堅陣を町田は破れず、アウェイの山形も最後まで１点が遠かった。

［ 文：郡司 聡 ］","[ ランコ ポポヴィッチ監督 ]
大部分のところで今日の試合に関しては満足しています。ただ最後の部分での落ち着きが少し足りませんでした。ラストパスを出すときの落ち着き、判断の部分のズレがあったので、修正をしていかないといけません。ただ90分を通して、チーム全体をオーガナイズしながら、アグレッシブに戦えたことは評価できます。選手たちのやり切る、戦う姿勢に関しては非常に満足しています。あとは相手陣内でボールを動かしているときにボールをつなぐだけではなく、相手にとって危険なプレーを増やしていかないといけないと思います。","[ 石丸 清隆監督 ]
アウェイでしっかり勝利を届けたかったんですけど、内容的にもちょっと消化不良のゲームをしてしまって申し訳ないと思っています。基本的に、自分たちからゲームが少しずつ崩れていったなという印象があるので、もう少し全体のオーガナイズをしっかり組んで選手が自信を持てるようにやっていかないと、どんどん相手を勢いに乗せちゃったなというのが今日のゲーム内容だと思います。もっとゴールを目指すプレーだったりシーンを増やしていかないと得点は生まれないと、今日の内容を見てつくづく感じているので、そういったところを修正して次につなげていきたいと思います。

－－今日は町田のプレッシャーに苦しんだ印象ですが、３バックでうまくボールを回せなかった要因はどこにありますか？
外から見ていると、選手たちはそこまでプレッシャーを強く感じてなかったように思いますが、１つのミスで、途中からどんどん消極的に、動きが止まったという印象があって、それで後ろが探し出したなと。逆に丁寧にやろうとし過ぎて相手のプレッシャーにハマったなという印象があるので、僕らが相手の組織的なプレッシャーを勢いづけたような攻撃をしたなという印象です。"
