Round,Hteam,Ateam,Hscore,Ascore,WorL,Preview,Review,H_comment,A_comment
明治安田生命Ｊ２リーグ　第1節,町田,東京Ｖ,1,0,3,"2019シーズンのオープニングマッチは、昨季最終節のリターンマッチ。Ｊリーグは粋な演出を用意した。

昨季の最終節。ホームの町田はＪ２優勝の可能性を残しており、アウェイの東京ＶはＪ１参入プレーオフ進出が懸かっていた。試合は１－１の引き分けに終わり、プレーオフ進出を果たした東京Ｖに対して、町田は優勝を逃し、失意に暮れた。町田にとって、今季の開幕戦は「ホームでその悔しさをぶつける」（中島 裕希）舞台。富樫 敬真や増田 卓也ら実力者を加え、チームの強化を図った町田が、ギャリー ジョン ホワイト新体制が発足した東京Ｖに挑む一戦は白熱必至だろう。

しかし、町田にとって相手の情報は乏しく、今季の東京Ｖがどんなスタイルのチームなのか、それはベールに包まれている。試合開始から相手のことを探りながら戦うゲームになりそうだが、古巣戦を戦う深津 康太は「どんな相手でも町田がやることは変わらない」と強調する。もともと町田は自分たちのサッカーを貫くことが勝利の可能性を高めると信じて戦うチーム。そのため、相手の状況をさほど意識する必要がない今回の試合は、むしろ好都合なのかもしれない。敵地に乗り込む東京Ｖにとっては、相手が出方を探りかねている間に先手を奪うことが、より勝利の可能性を高めるに違いない。

両チームが目指す景色は、Ｊ１昇格。その目標達成に向けて、幸先の良いスタートを切るチームは、町田か東京Ｖか。激闘必至の“東京クラシック”から、目が離せない。

［ 文：郡司 聡 ］","「ゲームプランどおりに戦って相手に上回られてしまった」

東京Ｖの藤本 寛也のこの言葉が、すべてを物語っているような試合だった。

ギャリー ジョン ホワイト新監督を迎えた東京Ｖは、町田対策として、ロングボールを蹴り合うことを選択。あえて相手の土俵に乗り、セカンドボールワークで優位に立ち、相手を上回るプランで試合に臨んだ。しかし、ロングボールを主体とした戦い方は、町田に一日の長がある。序盤からセカンドボールの出足で上回った町田が試合の主導権を握った。

序盤から優勢に立った町田は、新戦力の富樫 敬真が前半に二度ゴールネットを揺らしたが、ファウルとオフサイドの判定でノーゴールに。０－０で迎えたハーフタイムには相馬 直樹監督が「想像を超えるプレーをしなければゴールは決まらない」とハッパをかけた。

こうして迎えた63分。自陣から奥山 政幸がボールを運び、中央のロメロ フランクにつなぐ。ロメロ フランクは相手の寄せに倒れ込みながらも前方の富樫へ展開し、エリア内に入った富樫が右足を振り抜く。町田が待望の先制点を奪った。

１点を追う東京Ｖは選手交代で活路を見いだそうとしたが、町田の体を張った守備を前にゴールを奪えず。ホームの町田が１－０で“東京クラシック”を制した。

「６年間、同じ戦い方を続けている町田と１週間でやろうとしたチームの差が結果に出たと思う」と東京Ｖの井上 潮音。“ロングボールを主体とした戦い方”で一日の長がある町田が、相手のゲームプランを粉砕する開幕戦勝利を挙げた。

［ 文：郡司 聡 ］","[ 相馬 直樹監督 ]
前半からわれわれらしい戦いの中で相手を押し込む展開にはなりました。おそらくヴェルディさんも監督さんのやりたいことのイメージとは違うというか、われわれ対策で戦ってきたと思います。最終的なスタッツはわれわれのシュート数が５本、相手が４本でした。ボックス付近までは行けているのですが、なかなかフィニッシュまで持ち込めなかった試合でした。ゴールを決めるためには、もう少し崩しのアイディアは課題になってくるのかなと感じました。それがわれわれにとっては大事なことだと感じたゲームでした。

他会場の結果も、１試合だけ点が動いた試合がありましたが、０－０や１－０というスコアが多く、タイトなゲームが多かったようです。やはりどのチームもこの試合のために準備をしてきましたので、それも開幕戦特有なのかなと。そういった中で、ハーフタイムに選手たちにも話したことですが、何か想像を超えるようなことをしないと点は取れないぞという話はしました。

ゴールシーンではあの距離であのタイミングでシュートを打ってくれたことがゴールにつながりました。また（ロメロ）フランクがギリギリ足を伸ばして、トゥーキックになりましたが、つないでくれました。またその前のことを言えば、奥山（政幸）がグッとボールを運んでくれて、ちょっとずつのプレーを積み重ねることでゴールにつなげてくれました。長いシーズンが始まりましたが、細かいプレーの積み重ねが結果につながっていきますし、それで相手に上回られると、相手に結果がいってしまいます。また次の試合は相手のスタジアムに乗り込む形にはなりますが、良い準備をしていきたいと思います。","[ ギャリー ジョン ホワイト監督 ]
今日の試合は選手たちがいつもやっているサッカーとは違うサッカーをしなくてはいけなかった。空中戦になることは分かっていて、そこは選手たちはうまくやってくれた。選手たちは、今日は自分たちのキャラクターを見せてくれた。それをやらなくてはいけないときにできるということも見せてくれた。

－－今日の試合で得た収穫と課題は？
ネガティブなところは負けたということ。ファンの皆さんには笑って終わってほしかったが、今日はファンの皆さんも活躍してくれた。ポジティブな面は、選手のパフォーマンスはすごく良かったと思う。常に美しいつなぐサッカーばかりでは、Ｊ２では勝てないということは伝えてあります。今日の経験を生かして、次回こういう相手と戦ったときに、同じような戦いができればいいと思います。選手のパフォーマンス、キャラクターを知れたことは良かったと思います。"
明治安田生命Ｊ２リーグ　第2節,柏,町田,1,0,0,"開幕戦に勝利したチーム同士の一戦。今季、９年ぶりにＪ２の舞台で戦うことになった柏は、ホーム開幕戦で昨季Ｊ２優勝まであと一歩に迫った町田を迎える。

柏にとって町田は、前節に対戦した山口と同じように初顔合わせの相手となる。そのため事前の情報量は少なく、ピッチ上での対応力が問われる。ただ、公式戦での対戦は初めてとはいえ、ここ数年は何度か練習試合で対峙しており、「コンパクトでロングボールを蹴ってくるイメージ」（手塚 康平）はチーム内で共有されている。また、昨季まで京都に所属していた染谷 悠太は「町田さんは引き込んでカウンターからセットプレーを奪ってモノにする流れがあるので、そのカウンターをつぶせさえすれば、セットプレーも少なくなる。しっかりアラートに対応しながら、カウンターの芽をつぶすことに集中しないといけない」と警戒すべき点を挙げる。一方で攻撃に目を移せば、クリスティアーノや瀬川 祐輔といったアタッカーの能力を考えれば、コンパクトな陣形を保ってくる町田に対し、チーム全体でどこにスペースが空いているのか、どこを使われるのがイヤなのかを考えて突いていければチャンスを作れるだろう。

町田にとって開幕２戦目で迎える柏との対戦は、自分たちの現在地を測るには良い機会。昨季４位と躍進を遂げたチームがＪ１昇格候補筆頭の相手に対してどのような戦いぶりを見せるか。新加入ながら開幕スタメンの座を射止め、さらに決勝ゴールを決めた富樫 敬真はすでにフィットしており、注目を集める存在だ。

長丁場の明治安田Ｊ２で連勝スタートと最高の出だしを見せるのはどちらだ。

［ 文：須賀 大輔 ］","開幕２連勝を懸けて三協フロンテア柏スタジアムで柏と町田が激突。開幕戦のスタメンから柏はガブリエルに代わり山崎 亮平を起用し、町田は同じ11人で挑んだ。

堅い展開となった前半、最初にペースを引き寄せたのは町田。黄色く染まるスタジアムの雰囲気に呑まれることなくアグレッシブな出足を見せ、15分までに４本のCKを獲得した。しかし、13分の場面のように古巣戦となる深津 康太が高い打点で合わせるシーンはあったが、決定的な形を作るまでには至らず。結局、この試合を通じて11本あったCKを得点につなげることはできなかった。

すると、20分には柏にビッグチャンスが到来。小池 龍太のフィードはタイミングよく飛び出してきたGK増田 卓也のクリアにあうが、こぼれ球を拾った瀬川 祐輔がロングシュートを放つ。クロスバーに当たり跳ね返ってきたボールに山崎が頭から飛び込んだが、これもゴール上に外れ、お互いにゴールネットを揺らすことなく前半を折り返した。

後半開始と同時に柏がオルンガを投入し、ややオープンな展開へと移行。開始早々にクリスティアーノが相手のミスからシュートを放てば、57分には奥山 政幸が強烈なシュートを見舞うなど両チームのゴール前で攻防が生まれ始めた。

そして、この試合唯一の得点が生まれたのは67分のことだった。柏がロングカウンターを発動した。自陣でボールを持った菊池 大介が右サイドに開いたクリスティアーノにロングボールを供給すると、寄せてきたDFをものともせず冷静に逆サイドの瀬川へラストパス。これを受けた背番号18はドリブルで相手をかわし、落ち着いてゴール右隅へと流し込んだ。

この結果、柏は開幕連勝を達成。１年でのＪ１復帰へ向け上々のスタートを切った。

［ 文：須賀 大輔 ］","[ ネルシーニョ監督 ]
難しい試合になることは予想していたけど、相手の町田さんが非常にコンパクトかつ空中戦に持ち込もうとする戦いの中で、前半は相手のペースに呑まれた試合だったんじゃないかなと思います。ただ、後半に入ってわれわれ本来の特徴であるボールを動かす、最終ラインからきちっとビルドアップするところを選手たちには話して、かつ、ボールを奪ってから反対サイドの空いているスペースにボールを持っていこうと選手には指示をしました。そうしたことでチームはうまく回り始めて今日のような結果で終わることができたと思っています。

－－後半のサッカーを前半からやりたかった？
相手のコンパクトな守備を崩すためにロングボールで来る相手に対してロングボールで応戦してしまった前半の戦い方だったと思いますけど、本来であれば相手が前がかりになってきたところを短いパスでポゼッションしながら逆サイドにボールを運んで速い攻撃を仕掛けることが狙いでしたし、今週はそういう目的を持ってトレーニングをやってきました。

－－後半頭からオルンガを投入した狙いは？
空中戦にもつれたときにクリス（クリスティアーノ）１人ではタメを作れていなかった時間帯が多かったので、守備のラインから前線にボールを蹴り出したときにサイドでボールを収められる選手がいなかった。オルンガを投入したことによって前線でタメを作り、相手CBがクリアしづらい状況を作ってくれたおかげで優勢に攻撃を進めることができたと思います。

－－苦しい展開の中でこの２試合を勝ち切ったことをどう評価していますか？
まだシーズンが始まったばかりなので、そういう意味ではわれわれが掲げている理想にはほど遠い状態にはあると思いますけど、２試合連続でポジティブな結果を収められていることは選手たちにとっても自信になると思いますし、よりストロングな部分を出しやすい雰囲気をわれわれの手で作れていると思います。","[ 相馬 直樹監督 ]
前半と後半を通して、非常に選手たちがタフに、そして勇気を持って戦ってくれたと思っています。その中でも勝ちに持っていけなかったのは、私の力不足も当然まだまだあるなと思っています。ただ選手たちは本当によく戦ってくれましたし、自分たちのプレーもまた見せてくれました。そういった意味では選手たちに感謝していますし、満足しています。

ただ柏さんのような素晴らしいチームに対して、これを勝ちにしていくためには、またトレーニングが必要だなと思うこともたくさんありました。それはそれでしっかりと町田に持ち帰ってさらに強くなって、次の試合に向けての準備を進めていきたいですし、柏さんとはもう１回対戦するチャンスがありますので、そのときには素晴らしい相手に勝てるようにしたいなと思います。"
明治安田生命Ｊ２リーグ　第3節,町田,山形,0,3,0,"前節、柏とのアウェイゲームで今季初黒星を喫した町田は今節、町田市立陸上競技場に山形を迎える。町田にとっては“リスタート”と言うべき一戦を前に、一昨季、長崎でＪ１昇格を経験している増田 卓也はこう言った。

「連敗をしないことがすごく大事で、ホームでは１つでも多くの勝点を取らなければならない」

Ｊ１昇格を目標に掲げるチームに足踏みは禁物。ホームの町田は“必勝態勢”で今節に臨む。

アウェイ３連戦のラストマッチとなる山形は、キャンプで鍛え上げた体力面と戦術的なベースに自信を持っているチーム。前節の横浜FC戦で２ゴールを決めた阪野 豊史は「町田とはタフなゲームになると思うけど、相手に負けないようなトレーニングは積んできた。自信を持ってぶつかっていきたい」と話した。ただし、そうした“ハードワークバトル”は町田も望むところ。古巣戦を戦う中島 裕希は「走る部分で負けると町田の良さは消える。基本的なところで勝つようにしたい」と語っている。

2016年にＪ２復帰を果たして以降、町田は山形戦６戦無敗を継続中。敵将・木山 隆之監督も前節の横浜FC戦後に「強い町田」であることを強調し、入念な準備に取り組むことを示唆していた。そうした敵将の警戒心を伝え聞いた中島は言う。

「木山監督が想像していることを上回れるように、いつも以上の町田を見せたい」

意地と意地が激突する“ハードワークバトル”。最後に勝利の凱歌を上げるチームは町田か、山形か。見る者の心を捉えて離さない熱戦が期待できそうだ。

［ 文：郡司 聡 ］","３バック中央のポジションで無失点勝利に貢献した山形の栗山 直樹は言った。

「サイドからチャンスがたくさん生まれていますし、サイド攻撃に手ごたえを感じています」

サイドを制圧した山形が、アウェイ３連戦のラストマッチを勝利で飾った。

先制点は20分。右サイドで三鬼 海が山内 寛史のディフェンスを振り切り、ゴール前へ鋭いグラウンダーのクロスボールを供給。ペナルティーエリア内で酒井 隆介のクリアボールを拾った山田 拓巳が右足のシュートを流し込み、山形が先制した。

追加点は66分。左サイドで阪野 豊史が粘ってボールをキープし、本田 拓也へ展開。本田がゴール前へ浮き球のパスを入れると、町田の両CBがボールに触るのよりも先に坂元 達裕が押し込み、山形が追加点を奪った。

ゲームの総仕上げは終盤の83分。三鬼のCKから相手DFのクリアボールをジェフェルソン バイアーノが頭で叩き込み、チーム３点目を決めている。

３－０での快勝にチームを率いる木山 隆之監督は「選手たちが努力してきたことがたくさん出たので、本当に良かった」とコメント。「チームとして何年も積み重ねてきたことが表現できるようになっている」と話し、現状のチームに手ごたえを感じていることを口にした。

一方、敗れた相馬 直樹監督は、「分かりやすい完敗のゲームだった」と話し、次節のアウェイ・金沢戦に向けて、チームの立て直しを誓っていた。

［ 文：郡司 聡 ］","[ 相馬 直樹監督 ]
まずはわれわれのホームに集まっていただいたことに感謝を申し上げますが、ホームで０－３という結果になってしまったことを非常に申し訳なく思っています。今日の試合はもう終わってしまったので、これをどう生かすかですが、分かりやすい完敗のゲームだったと思っています。試合に持っていくまで１週間、実際に試合に入るまで、そして試合に入ってからを含めて、そういったことで負けてしまったゲームかなと思います。そういう意味では惜しかったね、で負けるよりは良いかなと思います。実際に試合で何が起こったのか、それはこの１週間で何が起こっていたかになりますが、試合までの準備を含めて、次のゲームで取り返せるようにしたいなと思っています。","[ 木山 隆之監督 ]
アウェイ連戦が３試合目で、選手たちが努力してきたことがたくさん出たので、本当に良かったなと思います。ある程度、町田さんの戦い方も分かっている中でいかに戦うかをしっかりとトレーニングしてきたことを、今日のピッチの中で表現できました。ゴールできたことも良かったですが、アウェイで２つ勝利を取ってホームに戻れることが良かったです。またしっかりと準備をして初のホームゲームを迎えたいと思います。

－－攻守ともに良いゲームができたと思いますが、最も評価できる点は何でしょうか？
攻守ともに集中力も高いですし、プレーの安定度も試合をこなすごとに増しています。一人ひとりの充実度も含めて、チームとして何年も積み重ねてきたことが表現できるようになっていると思っています。そういう意味では充実してきたなという印象で見ています。"
