Round,Hteam,Ateam,Hscore,Ascore,WorL,Preview,Review,H_comment,A_comment
明治安田生命Ｊ３リーグ　第27節,鳥取,岩手,1,0,0,"鳥取は前節、YS横浜を４－１で下し、ホームでは９月の明治安田Ｊ３第15節以来、約２カ月ぶりの勝利。４－０としたあとにPKで１点を返され、７試合連続で失点したのは反省材料だが、６位に浮上してＪ２昇格圏内の２位との勝点差は『５』に縮まった。後半戦に入って敗戦が増え、勝点が伸び悩みながらも、２位争いが混戦となっていることで致命的な出遅れを回避しており、残り８試合で上位５チームとの直接対決も残っている。前節でプロ初のハットトリックを達成した大久保 優、今季チーム最多の７得点を挙げている田口 裕也など、攻撃陣が結果を残して主導権を引き寄せたい。

一方の岩手は前節、八戸と１－１の引き分け。後半アディショナルタイムの失点で連勝こそ逃したものの、前々節で今季初得点を挙げた有永 一生が２試合連続得点中と好調だ。どちらの得点も左からのクロスをヘッドで合わせており、このサイドの攻防は勝敗を分ける要素になり得る。また、第14節で対戦したときは、セットプレーからの２得点により岩手が２－０で勝利。セットプレーからの失点が多い鳥取の弱点を突き、シーズンダブルを狙う。

［ 文：石倉 利英 ］","明治安田Ｊ３第27節、鳥取対岩手は１－０で鳥取が勝利を収めた。強い風が吹く中、前半は風下だった鳥取は25分、三沢 直人のCKを井上 黎生人がヘッドで触り、ファーサイドに流れたところを上松 瑛が押し込んで先制。岩手もセットプレーなどで反撃の機会をうかがったものの、そのまま１－０で前半を終えた。後半は鳥取が風上を生かせず、ミスが増えてチャンスを作れないのに対し、岩手も敵陣に入ってからゴール前まで入り込めない。それでも終盤は押し込んだが、鳥取が１点を守り切った。

［ 文：石倉 利英 ］",コメントなし,コメントなし
明治安田生命Ｊ３リーグ　第28節,岩手,相模原,1,1,1,"岩手は前節、アウェイでの鳥取戦に臨んだ。強風の中、互いに決定機の少ない試合となったが、鳥取がCKから得たゴールを守り切り勝利。岩手はこれまでの戦い同様、守備は大きく崩されていないながらも攻撃の迫力を欠き、無得点での敗戦となった。今節は１カ月半ぶりのいわぎんスタジアムでの試合となるが、ホームでチャンスを量産し、得点につなげ、スタンドを沸かせたい。

対する相模原も中盤戦以降、守備の堅さをベースに接戦で勝利しながら順位を上げ、４位。昇格圏まで勝点３差の位置につけ、終盤戦での逆転、Ｊ２昇格を目指す。12試合連続で負けがなく、着実に勝点を積み上げている反面、ここ４試合はすべてドローとなっており、勝ち切る力を見せつけられるかどうかが、昇格への大きなカギとなるだろう。岩手相手に５試合ぶりの勝利を挙げ、波に乗れるかに注目が集まる。

岩手にとって相模原は今季初勝利の相手でもあり、ポジティブなメンタリティーで試合に臨みたい。今季は先制できれば強さを見せる反面、先に失点すると押し返せずに敗北を喫する試合が続いており、是が非でも先制点が欲しい。

［ 文：髙橋 拓磨 ］","セットプレーとカウンターという共通の強みを持つチーム同士の対戦となった今節。下馬評通り、激しいゴール前での攻防が展開された。

前半、両チームともセットプレーからチャンスを得るものの、守備陣が強さを見せ、互いにゴールを割らせない。24分、相模原はCKの折り返しを中央フリーで合わせるが、岩手の守護神の土井 康平がビッグセーブを見せ、スコアは動かないまま後半へ。

攻勢を強める相模原だったが、その間隙を縫うように岩手が先制。72分、FKから牟田 雄祐がヘッドで今季５ゴール目を記録した。しかし、昇格に向けて負けられない相模原は、運動量の落ちた岩手を相手に攻め立てる。その攻撃が実ったのは87分。途中出場のユーリが値千金の同点ゴールを決め、試合を振り出しに戻す。後半アディショナルタイムにも互いにチャンスがあったものの、試合は１－１のまま終了。相模原は５試合連続の引き分け、一方の岩手は、ホームの試合では２戦連続となる終盤の失点。勝点３を逃している。

［ 文：髙橋 拓磨 ］",コメントなし,コメントなし
明治安田生命Ｊ３リーグ　第29節,Ｇ大23,岩手,0,1,3,"前節は首位の秋田に対して、今季最多となる７人の２種登録のユース組が先発。自らのミスで後手に回り敗戦に終わったＧ大23だが、中村 仁郎らが秋田に対しても存在感を見せるなど一定の収穫を得た一戦だった。

ただ、ホームで６試合ぶりに喫した黒星に森下 仁志監督や選手たちが満足するはずがない。

仕切り直しとなる岩手戦は中３日の連戦となるが、同日にトップチームの浦和戦が行われることもあり、秋田戦と比べれば充実した顔ぶれで挑める可能性は十分だ。

「ホームで残り３試合。１つでも多く勝ち切りたい」と森下監督も気合い十分だが、やはり勝利のカギを握るのはオーバーエイジ枠で起用されている高木 大輔らプロ組の奮起だろう。秋田に対してもゴール前まではボールを運べていたＧ大23だが、欠いているのはゴール前の迫力。勝ちがない直近の７試合で奪ったゴールはわずかに『４』。試合を支配しながらも勝ち切れない要因となっている。

一方の岩手は前節、相模原とドローに終わっており、４試合ぶりの勝利に燃えて敵地に乗り込んでくる。ホームでは１－０で辛勝している岩手だが、注目はかつてＧ大23でもプレーした嫁阪 翔太の存在だ。

互いに勝ちが欲しい一戦でゴール前の攻防が多くなる気配が漂っている。

［ 文：下薗 昌記 ］","前節、秋田に敗れてホームで仕切り直しを図るＧ大23は、オーバーエイジ枠で三浦 弦太がＪ３に出場。新里 亮とともに最終ラインにベテランをそろえたはずのＧ大23だったが８分、モレラトが右サイドからカットインし、強烈なシュートを叩き込む。

ホームで連敗はできないＧ大23は塚元 大が攻撃をけん引。30分には塚元のシュートがクロスバーを叩くも、その後は自陣でブロックを形成。体を張りながら気持ちを見せる岩手の守りをこじ開け切れず、タイムアップの笛を聞いた。

「中盤から前が弱い」と森下 仁志監督が振り返ったように、シュート19本を浴びせながらも、決定力を欠いたＧ大23が岩手の粘りに屈した。

［ 文：下薗 昌記 ］",コメントなし,コメントなし
明治安田生命Ｊ３リーグ　第30節,岩手,鹿児島,0,1,0,"個の能力に優れた選手がボールを保持しながら厚みのある攻撃を仕掛ける鹿児島と、得意のカウンターからの一発を狙う岩手が対戦する。

中盤戦から失点数が減少し、ソリッドな守備からのカウンターが戦術のベースとなっている岩手。前節のＧ大23戦でも前半にモレラトが強烈なミドルシュートを突き刺し、得意とする先行逃げ切りの形で勝点３を手にした。今季９勝目を挙げたが、そのうち５試合が１－０、いわゆる“ウノゼロ”での勝利となっている。

前節、相模原との上位対決に敗れ、昇格圏内までの勝点差が『７』に広がってしまった９位の鹿児島。ボールを支配しながらも１点が遠く、終了間際に痛恨の失点を喫してしまった。１シーズンでのＪ２復帰はかなり厳しい状況となったが、勝点３を取り続けることで、わずかな可能性に懸けたい。

前節同様に、岩手はボールを握られる時間帯が多く、耐える展開が予想される。岩手にとってはリーグ６位の41ゴールを記録している鹿児島の攻撃陣をシャットアウトし、少ないチャンスをどうモノにするかが勝利へのカギ。好調が続く、前線の起点役であるブレンネルのパフォーマンスにも期待がかかる。

［ 文：髙橋 拓磨 ］","互いに攻撃的な姿勢を打ち出しながら試合は展開。鹿児島が厚みのある攻撃でゴールに迫り、岩手はブレンネル、モレラトを中心としたカウンターで応戦する。そんな中、先制に成功したのは鹿児島。再三狙っていたCBとウイングバックの間を突くと、32分、混戦から最後は酒本 憲幸がゴールネットを揺らした。

後半に入ると、運動量の落ちた鹿児島に対し、岩手が主導権を握り攻勢を強める。しかし、シュートはことごとく枠を外れ、チャンスを生かせない。攻撃的なカードを切り、終盤は２トップにしてパワープレーを仕掛ける岩手。アディショナルタイムにその流れからペナルティーエリア内で決定的なシュートを放つもののクロスバーを越え、結局無得点のまま終了。鹿児島は昇格へ向け、わずかな希望をつなぐ勝点３となった。

［ 文：髙橋 拓磨 ］",コメントなし,コメントなし
明治安田生命Ｊ３リーグ　第31節,岩手,熊本,2,2,1,"熊本は11月の６試合で２分４敗とまさかの大失速で６位に後退。勝負どころとなる時期に大きくブレーキが掛かり、昇格圏までは残り４試合で勝点６差に広がった。Ｊ２復帰という目標に対して赤に近い黄色信号が灯っている状況ではあるが、次節に望みをつなぐためにも勝利は必須。失点が急増している守備の安定感を取り戻し、持ち前の攻撃的なサッカーを展開したい。

今節がホーム最終戦となる岩手も、勝利への渇望は同様だ。前節はビハインドで迎えた後半に攻勢を仕掛けるものの、ゴールは奪えずに悔しい敗戦となった。秋田 豊監督は試合後、「内容は悪くなかった。残り試合は結果と内容、両方を求めていきたい」と最終盤に向けての意欲を口にした。今季、いわぎんスタジアムでは７試合を戦い、わずかに１勝と物足りない結果に終わっている。本拠地でサポーターの鬱憤を晴らすためにも、前節同様、ボールを奪う姿勢、相手ゴールにどん欲に迫る姿勢を強調したアグレッシブなプレーを期待したい。

［ 文：髙橋 拓磨 ］","立ち上がりからポゼッションを高めて崩しにかかる熊本に対し、岩手もタイトな守備でゴールを死守。熊本は決定機をたびたび作るが、GK土井 康平が二度の１対１をセーブするなど、大きな壁として立ちはだかり、０－０のまま後半に進む。

後半、岩手はブレンネルのPKで先制したものの、熊本も谷口 海斗の見事なボレーシュートですぐさま同点に追いつく。Ｊ２昇格へ向けて勝点３が欲しい熊本は85分に中原 輝が得意の左足で勝ち越しゴールを挙げたが、その３分後、岩手の小谷 光毅に決められ、痛恨の失点。ホーム最終戦で意地を見せた岩手が追いつき、試合は２－２で終了。熊本は７試合未勝利と昇格に向けてさらに厳しい状況となった。

［ 文：髙橋 拓磨 ］",コメントなし,コメントなし
明治安田生命Ｊ３リーグ　第32節,今治,岩手,2,0,0,"今治は明治安田Ｊ３第28節、敵地で熊本との激闘を制し、Ｊ３参戦初年度にしてＪ２昇格の可能性がグッと近づいてきたかと思えば、その後、福島、長野との戦いで連敗を喫し、再び昇格への望みは遠のいた。しかし前節、すでにリーグ優勝および昇格を決めている秋田に３発快勝。敵地で意地を見せ、かろうじて昇格への望みを今節につなげることができた。

「残り試合、全部勝たないと昇格はできないと思っている」（原田 亘）

選手たちもそう認識しているとおり、今節は負ければほぼ昇格絶望のサバイバルマッチとなるが、だからこそ失うものは何もない。チームとしては終盤戦に入って守備の手堅さを保ちつつ、攻撃面では最前線に突破力のあるレオ ミネイロを置いて戦術の幅も広がっている。今節も攻守で持ち味を発揮できるか。

一方、岩手は前半戦こそ苦しんだが、秋田 豊監督はＪ３の戦いにも徐々に順応。中盤戦以降は安定した結果を出している。すでに秋田監督の来季続投が発表されており、来季良いスタートを切るためにも、上位相手に結果を残したいところだ。

［ 文：松本 隆志 ］","勝って昇格の望みをつなげたい今治だが、前半は苦しい戦いを強いられた。

球際を激しく戦いながらブレンネルを起点にして攻める岩手に対して耐える時間が続いたが、我慢強く戦って前半を無失点で折り返すと、後半にチャンスを生かした。55分、後半から出場した桑島 良汰のパスを受けた原田 亘が左足で放ったシュートはポストに当たってゴールマウスに吸い込まれた。

終盤には岩手に攻め込まれてゴールを脅かされる場面も多かった今治だったが、守備陣が集中力を切らさず守って90分には林 誠道が追加点をゲット。効率よく得点を重ねた今治が勝点３を積み上げ、４位タイに浮上した。

［ 文：寺田 弘幸 ］",コメントなし,コメントなし
明治安田生命Ｊ３リーグ　第33節,Ｃ大23,岩手,0,5,3,"今季初の連勝を目指して挑んだ前節の讃岐戦、Ｃ大23は開始早々のピンチをしのぐと、攻守にアグレッシブな姿勢で主導権を握り、前半には島村 拓弥、後半にも藤尾 翔太らが決定機を迎えたが、惜しくも決めることはできず、０－０で終えた。２試合連続無失点と守備の奮闘は目立つだけに、残り２試合、得点力を少しでも上げていきたい。

今節は８得点を挙げているエース・藤尾が出場停止だが、チーム全体で補い、勝利を手繰り寄せるゴールを手にしたい。今季だけではなく、Ｃ大23としても残り２試合となった。どちらもホームでできることはプラス。スタジアムに駆けつけてくれるサポーターのためにも、ハツラツとしたプレーがピッチで見られることに期待したい。

一方の岩手は中位にとどまるシーズンとなったが、今季から指揮を執っている秋田 豊監督の来季続投も発表された。残り２試合の内容、結果は来季へもつながっていくだけに、一戦たりとも無駄にしていい試合はない。今節、４試合ぶりの勝利を手にし、最終節へ臨みたい。

［ 文：小田 尚史 ］","９分、岩手が右サイドからのクロスでオウンゴールを誘発して先制に成功すると、その後も前向きな圧力を掛け続けてＣ大23を圧倒。19分には、自らの突破から得たPKをブレンネルが決めて追加点。その後も決定機の山を築いた岩手の勢いは後半に入っても落ちず、50分から７分間で３得点を追加。試合を決めた。

攻勢に出る岩手の前に後手に回り続けたＣ大23。終盤は反撃を試み、終了間際には決定機も作ったが、一矢報いることはできず、完敗に終わった。チームとしてもラストゲームとなる次節、今季の最終戦で、この悔しさを晴らせるか。

［ 文：小田 尚史 ］",コメントなし,コメントなし
明治安田生命Ｊ３リーグ　第34節,長野,岩手,0,2,3,"明治安田Ｊ３も最終節を迎える。スタートダッシュに成功した首位・秋田が勢いを消すことなく早々と優勝を決めた一方、２位争いは最後までもつれる展開となった。

現時点でＪ２昇格の可能性があるのは２位・長野、３位・相模原、４位・岐阜の３チーム。その中にあって優位に立っているのは長野だ。足踏みの続いた時期もあったが、第30節～第32節まで３連勝を果たすと、前節・岐阜戦も押し込まれながらも引き分けに持ち込んだ。しぶとい戦いで開幕から勝点を積み重ね、今節に勝てば２位が確定する。多くの注目を集めるゲームになるが、どれだけ重圧を取り払い、平常心で臨めるかがカギになるだろう。

対するアウェイ・岩手も、目の前で歓喜の胴上げを見せられるわけにはいかない。「全員でしっかりと戦えば、勝利できると思う。アウェイだが勝利できるように頑張りたい」と前節・Ｃ大23戦で２ゴールを挙げたブレンネルも勝利への執着心を見せており、敵役となる覚悟はできている。前節のように早い時間から相手に圧力を掛けて、主導権を引き寄せたい。

［ 文：吉田 義生 ］","長野にとって勝てば昇格が決まる試合は、雪が舞い散る寒空の中、試合開始のホイッスルが吹かれた。

中を閉める岩手に対し、長野は幅と深さで揺さぶりをかける。前半終了間際には厚みのある攻撃を繰り出し、あとわずかでゴールという決定機を再三つかんだが、GK土井 康平を中心とした守備の前にゴールを割ることはできなかった。

前半、岩手をシュートゼロに抑えていた長野だが、55分、モレラトに押し込まれて先制を許す。ビハインドの中、ポゼッションをしながら打開を試みるが、岩手の堅いブロックの前に攻撃陣が沈黙し、チャンスを作れない。85分にもミスから２点目を奪われると、試合はそのまま０－２で終了した。昇格を争う相模原が勝利したことで、長野は３位となり、悲願の昇格はならず。2015シーズン以降、３分３敗という長野Ｕスタジアムの天敵・岩手が長野の昇格を阻んだ格好となった。

［ 文：髙橋 拓磨 ］",コメントなし,コメントなし
明治安田生命Ｊ３リーグ　第1節,宮崎,岩手,0,1,3,"念願のＪリーグ入りを果たした宮崎。ホームのユニリーバスタジアム新富に岩手を迎え、いよいよ明治安田Ｊ３での初陣である。

宮崎はほとんどの主力が残留したため、戦い方はおおむね昨季同様だと考える。試合前半は、後方からの素早いパス回しや、前線のポストプレーヤー・水永 翔馬をターゲットにしたロングキックで相手ゴールに迫る。後半は俊足のサミュエル、ドリブラーの渡邊 龍、梅田 魁人などを投入する。相手をかく乱してゴールを狙うという、ＪＦＬで見せていた攻撃がＪ３でどこまで通用するかが見どころだ。また、新たに就任した内藤 就行監督がどのような采配を振るのか。

一方の岩手は、昨季果たせなかったＪ２昇格を目指す戦いが再び始まる。宮崎の内藤監督、岩手の秋田 豊監督の鹿島OB対決にも注目したい。

宮崎のクラブとしての課題は観客動員にある。新しいサッカー専用スタジアムが、どれだけの集客につながるかも、今後の戦いに影響を与える要素だろう。そこも含め、しっかり見届けたい。

［ 文：高浜 確也 ］","Ｊ３昇格を果たした宮崎。岩手を完成したばかりのユニリーバスタジアム新富に迎え撃つ。前半、宮崎は前田 椋介が組み立て、徳永 裕大のパスワークや梅田 魁人の迫力あるドリブルでチャンスを作る。一方の岩手は、ディフェンスラインを高く取り、前線に張る韓 勇太を中心にゴールを狙う。しかし互いに決定機を外すなど、０－０で終えた。

後半に入り61分、前線からのパスを受けた岩手の中野 雅臣が左足で豪快に決め、均衡が破れた。宮崎は上背のあるFW橋本 啓吾や俊足のサミュエルを投入。昨季慣れ親しんだシステムで追いすがるが、岩手の大きな壁に阻まれゴールはならず。初戦を落とすこととなった。

［ 文：高浜 確也 ］",コメントなし,コメントなし
明治安田生命Ｊ３リーグ　第2節,鳥取,岩手,1,1,1,"鳥取は前節、アウェイで鹿児島と対戦し、３－２で勝利。前後半の立ち上がりに失点して０－２とされる苦しい展開だったが、65分と74分の得点で追いつき、最後は後半アディショナルタイムの得点で劇的な勝点３を手にした。昨季も多かったセットプレーからの失点など課題も残ったが、Ｊリーグデビュー戦で１点目を決めた18歳の石田 侑資、同点ゴールを決めた19歳の田口 裕也など、途中出場した若い力が結果を出し、劣勢をひっくり返すことができたのは今後へのプラス材料だろう。

岩手も前節はアウェイで、Ｊ３初戦だった宮崎に１－０で勝利。前半に際どいピンチもあったがしのぎ、後半にスローインの流れから中野 雅臣が決勝点を奪った。FK、CKも含めたリスタートからの得点力は岩手の持ち味の１つ。昨季、鳥取とのホーム戦も、リスタートからの２得点で２－０の勝利をつかんでおり、鳥取のGK田尻 健は「無駄なファウルをしないことも大事になる」と警戒している。鳥取も開幕戦の３得点中２得点がCKからで、リスタートの攻防が勝敗のカギを握るかもしれない。

［ 文：石倉 利英 ］","明治安田Ｊ３第２節、鳥取対岩手は１－１の引き分けに終わった。

前半、右サイドからのセンタリングを中心にチャンスを作っていた岩手は、39分にセットプレーのこぼれ球を拾った石井 圭太がミドルシュートを決めて先制。

しかし、鳥取も66分に右サイドを崩し、最後は新井 光が２試合連続ゴールを決めて追いついた。直後の67分、岩手の中村 太亮が２回目の警告を受けて退場となる。数的優位に立った鳥取が攻め立てたものの、岩手も踏ん張って守り切り、互いに勝点１を分け合う結果となった。

［ 文：石倉 利英 ］",コメントなし,コメントなし
