Round,Hteam,Ateam,Hscore,Ascore,WorL,Preview,Review,H_comment,A_comment
明治安田生命Ｊ２リーグ　第8節,秋田,岩手,3,1,0,"岩手には昇格チームならではの勢いがある。秋田には泥にまみれながらＪ２残留を果たした知見がある。勝つのはどちらか。“奥州合戦”がいま、幕を切って落とす。

Ｊ３発足の2014年から、秋田がＪ２に昇格する2020年までの７年間にわたり、何度となく激闘を繰り広げてきた隣県の秋田と岩手。2021年に岩手がＪ２昇格を決めたことで、上のステージで２年ぶりにぶつかり合う。「ライバルがあることはありがたい。ダービーとはチームとチームではなくて、街と街、県と県の戦い。県を代表し、熱意を持ってチーム全員で戦いたい」と吉田 謙監督。今季は山形を交えた３つ巴の“奥州合戦”と銘打ち、サッカーで東北全体を盛り上げていく。

秋田は前節、ホームの甲府戦をスコアレスドローで終えた。前半は甲府に押し込まれて防戦を強いられるも、GK新井 栄聡を中心に無失点でしのぐ。すると後半は一転して秋田が攻勢に出る。コンパクトな陣形ごと前に押し上げて、相手のビルドアップにプレッシャーを掛けて流れを変えた。スコアは動かなかったが、失点しなかったこと、自分たちでゲーム中に修正して試合運びを優位に進めたことは収穫だ。稲葉 修土は「勝ちたかったが、負けないことも大事。この勝点１を次につなげたい」と前を向く。

対する岩手は前節、アウェイで岡山と対戦し０－１で競り勝った。15分に中村 太亮の右CKを甲斐 健太郎が押し込んで先制。岡山の反撃を振り切り、無失点で４試合ぶりの勝点３を手にして６位に浮上。セットプレーの質の高さに加え、遠めからでもシュートを打っていく積極性が目を引く。３連戦の最後を勝利で締めくくろうと、勢いを持ってソユースタジアムに乗り込むだろう。

フォーメーションや戦術は違えど、ハードワークをベースとする粘り強さが強みの両チーム。７試合を終えて秋田が４得点６失点で、岩手が５得点６失点。堅守が際立つ一方で得点力に課題がある点が共通している。この数字を見ても、先制点が勝敗を分ける緊迫した試合展開となりそうだ。

［ 文：竹内 松裕 ］","秋田は前節から３人を入れ替え、青木 翔大と齋藤 恵太が２トップを組み、中村 亮太が今季初スタメン。岩手は前節と同じ11人で臨んだ。

立ち上がりから主導権を握ったのは秋田。岩手のロングボールをきっちりはね返し、セカンドボールを奪って両サイドからショートカウンターを展開していく。すると５分に秋田が先制に成功する。茂 平がペナルティーエリア手前でキープして中央へクロス。これを齋藤が頭で合わせ、ゴール右スミに流し込んだ。

秋田はコンパクトな陣形を維持しながら、良い距離感で選手同士が連動し、高い位置でボールを奪って前進する。そして16分に追加点を奪う。飯尾 竜太朗が相手のファウルを受けてペナルティーエリア左でFKを得る。すると飯尾のキックを中村がうまく頭で合わせて２－０とする。

岩手も黙っていない。ブレンネルが激しいマークに遭う中、右サイドで和田 昌士がボールを受けて全体を押し上げ右CKを獲得。一度ははじかれるものの、色摩 雄貴が粘り強く押し込んで反撃の狼煙を上げる。

しかし後半の立ち上がりも秋田が流れをつかみ、いきなり追加点を奪う。CKのこぼれ球を拾って中央へ折り返し、最後は青木が押し込んで突き放しにかかる。

岩手は59分に３枚代えを敢行して流れを引き寄せようとする。しかし球際の競り合いで優位に立つ秋田がボールを押し返し、敵陣で積極的にシュートを放っていく。岩手はその後セカンドボールを回収して押し込むようになるが、秋田も簡単にやらせず長短のカウンターで対抗する。

岩手はもちろん、秋田も次の１点を決めようと攻撃を仕掛け、最後の笛が鳴るまで両チームの選手たちが球際の競り合いを展開する。それでもスコアは動かず３－１で試合終了。

記念すべき""奥州合戦""の第１ラウンドは秋田が制し、４試合ぶりの勝利をホームのサポーターと分かち合った。

［ 文：竹内 松裕 ］","[ 吉田 謙監督 ]
秋田の皆さま。どんなときも選手を支えていただき本当にありがとうございます。皆さまの応援、選手たちの躍動、それが１つとなって勝利することができました。これからもひたむきに全力で戦い続けたいと思います。

－－前半からパワーを出そうとするプランだったか。
どんな試合も前半からフルパワーで出し切る。それがしっかり勝利に結びついたと思います。

－－決めるべきところを決めた。前線の選手が成長しているか。
日頃からチームみんなでも同じように描いて、それを極めていく。それに限界はございませんので、これからもさらに突き詰めて、チームみんなで高みを目指したいと思います。

－－青木 翔大選手の移籍後初ゴールについて。
こぼれ球が青木のところに来るということは、青木がいつもそこにポジションを取っている。チーム全体でこぼれ球を拾い続ける。そのポジショニング、執念。神様が少し有利にしてくれたと思います。","[ 秋田 豊監督 ]
岩手からたくさんのサポーターの皆さんに来ていただきまして、ありがとうございました。対策していたセットプレー、背後のボール、クロスというところに立ち上がりで屈して、失点してしまったという形になりました。２年前もそうですが、そういったところの守備をもっともっとクリアにしていかないと、グルージャは上には行けないと感じています。

やっぱり自分たちの力を継続して発揮することができていないので、そこが一番の課題になっています。次節、もう一度仕切り直して、勝点を奪っていけるようにやっていきたいと思います。

－－相手の特長を出させてしまった要因と、自分たちの特長を出せなかった要因について。
本来、守らなければいけないゾーンというのがセットプレーでもそうですけど、守れていないことだと思います。

－－相手の特長を踏まえ、どういった狙いで得点を狙ったか。
同サイドから攻撃を仕掛けるチームなので、奪って逆サイドから速い攻撃をするということと、相手CBのところで１対１を仕掛けるというところが狙いではありましたが、ほとんどできませんでした。

－－今後に向けて。
試合が終わったあと、選手たちにはもうこんな悔しい思いはしたくないということ、苦手意識を持っているブラウブリッツ秋田さんのサッカーに対して勝たせてはいけないということを話しました。課題は１勝するとその後の試合で緩んでしまうところだと思います。"
明治安田生命Ｊ２リーグ　第9節,岩手,群馬,0,1,0,"岩手にとっては今季ホーム３戦目。これまでの２試合は引き分けに終わっているだけに、ホーム初勝利をサポーターと分かち合いたい。

キャプテン・牟田 雄祐の「秋田のひたむきで徹底したサッカーにしっかり負けた試合」という言葉に象徴されるように、チームとして前節・秋田戦は完敗を喫した。攻撃に出た回数はごくわずかで、守備ではリスタートから３失点。２失点後、CKから色摩 雄貴がバイシクル気味のシュートを決めたが、主導権は握れず、攻守に課題をあぶり出される形となった。

前々節の岡山戦からは［３－５－２］を採用。「完成度はまだまだ」（秋田 豊監督）という声は選手からも聞こえており、さらなるブラッシュアップを重ね、ベースとなる守備強度をさらに高めるとともに、攻撃パターンの構築を進めたい。

群馬は直近３試合で７失点と、それ以前の５試合で１失点だった守備がほころびを見せている印象もあった。しかし、前節は水戸との“北関東ダービー”を２－１で制して、連敗を『２』でストップさせた。失点増の一方で得点も増加傾向にある。特にビハインドになったあとの鋭い攻撃は見ごたえ十分で、最後まで目の離せない戦いを見せている。

試合のカギを握りそうなのが立ち上がりのゲームコントロールだろう。群馬は連敗した明治安田Ｊ２第６節・新潟戦、前々節・長崎戦で早い時間帯に失点を喫した。岩手も秋田戦では開始16分で２点を失った。両者ともに先制できれば我慢強く守り抜く力はあるだけに、この時間をどう戦うか、ゴールが生まれるかどうかで試合展開が大きく変わってくる可能性は高い。

３勝２分３敗の勝点11で並ぶチーム同士の対戦。勝利を先行させ、上位浮上の足がかりとしたい。

［ 文：髙橋 拓磨 ］","試合は立ち上がり５分で三度のCKを得るなど、群馬が両サイドを押し込む形でスタート。15分には、深堀 隼平がディフェンスラインの裏を取り惜しい形を作ったものの、その後は攻撃がやや停滞した。

一方の岩手は５分過ぎに［３－４－２－１］でスタートしたシステムを［３－５－２］に変えると、流れをつかみ始める。中盤を経由しながらサイドに起点を作り攻撃を仕掛けると、徐々にゴール前に迫るシーンを増やし始める。前半最大の決定機は34分。牟田 雄祐からのクロスを弓削 翼がヘディングで合わせたが惜しくもポストに直撃。こぼれ球を拾った和田 昌士のシュートもDFのブロックに阻まれた。

後半はやや運動量が落ち始めた岩手に対して群馬が積極的にゴールを狙う。またしても深堀にビッグチャンスが訪れるが、岩手GK野澤 大志ブランドンが好セーブを見せ、スコアレスのじりじりとした展開が続いた。

群馬が押し込む時間帯が増えてきた中、岩手は３枚代えで流れを変えに動く。すると、73分に途中出場の中村 充孝が左から決定的なクロスを供給。ビスマルクのシュート、こぼれ球に桐 蒼太がフリーでシュートも、群馬GK櫛引 政敏が神がかったセーブでゴールを死守。直後にもブレンネルのミドル、中村 太亮のCKからのチャンスなど、決まってもおかしくない場面を再三迎えた岩手だったが、櫛引を中心とした群馬守備陣はゴールを割らせない。

スコアレスでの試合終了が濃厚かに思われた89分、耐え忍び続けた群馬がワンチャンスをモノにする。右からのアーリークロスに途中出場の平松 宗がヘディングで合わせ、値千金の決勝ゴール。試合はこのまま終了し、劇的な展開でゴールをこじ開けた群馬が連勝を飾った。

［ 文：髙橋 拓磨 ］","[ 秋田 豊監督 ]
今日もたくさんのサポーターにきていただきました。ありがとうございます。プランどおりに、選手たちは自分たちのやるべき仕事をやってくれたと思います。ただ、最後の集中力の部分、決め切るべきところで決められなかったことで３ポイントを落とすことになったと感じています。それでも明るい光は見えたので、次に向かって良い準備をしていきたいと思います。

－－明るい光とは具体的にどんな部分か。
良い形で守備をしながら相手にチャンスを作らせず、こちらがカウンターからチャンスを作れたところが非常に良かったと思います。

－－攻撃面の評価は。
（前節・）秋田との試合に比べて、ゴール前でのチャンスがたくさんできたことは評価したいと思います。押し込んでのチャンス、カウンター、セットプレー、いろいろなバリエーションができたと思います。

－－次節・大分戦に向けて。
大分が良いチームであるのは間違いないと思います。ただ、ネガティブになる必要はなくて、42試合の中の１試合。自分たちがやれることを精一杯やることがすごく大事になってきます。出し切ることが勝点３につながってくると思います。","[ 大槻 毅監督 ]
今日は本当に難しいゲームでした。結果的に勝点３が取れましたが、ラッキーとかアンラッキーという言葉で片づけずに、しっかりとゲームの内容を見て次に進むことをやらなければいけないというゲームでした。また、この試合をきっかけに成長できるようになりたいと思わせてもらえるゲームでした。

－－初の連勝について。
よく我慢したと思います。相手にビッグチャンスが何度かありましたが、（スコアレスのまま）勝点１がゼロにならずに、勝点３になったことはありがたいです。岩手さんが良いチームで難しいゲームになりましたが、このような結果になって良かったです。"
明治安田生命Ｊ２リーグ　第10節,岩手,大分,1,2,0,"４月に入り、２連敗と結果が出ていない岩手は順位を15位に落とした。とはいえ、前節の群馬戦は「全体的にはポジティブだった」（秋田 豊監督）と敗れはしたものの、内容では相手を大きく上回った。守備ではピンチを招かず、攻撃では決定機を量産。それでも決め切れずにいると、最終盤にショートカウンターから失点し、そのつけを払わされた。

敗れはしたが、オプションとなる［３－５－２］の精度は試合ごとに向上し、新たな一面もピッチで表現できつつある。攻撃で変化をつける増田 隼司、和田 昌士の両インサイドハーフは「プレーしていて楽しいし、自分の特長が生きるポジション」とプレーに手ごたえを感じていて、チーム全体の攻守における共通理解も進んでいる。

今季序盤は結果がついてこなかった大分だが、明治安田Ｊ２第６節の琉球戦で４－１と勝利して以降４試合で３勝。一気に順位を中位まで押し上げた。前節は徳島相手にクリーンシートで勝利。下平 隆宏監督は「徳島さんにボールを持たれる時間帯が長く、決定機も相手のほうが多かった」としながらも、苦しい展開の中、粘りを見せて勝ち取った勝点３に大きな価値を見いだしていた。

過密日程が続く大分は、13日にＪリーグYBCルヴァンカップでＧ大阪と戦い、中２日で岩手戦を迎える。徳島戦からスタメン全員を入れ替えて臨んだとはいえ、連戦がどう影響するかも試合のポイントとなりそうだ。

互いのマスコットキャラクターのモチーフが鶴（キヅール）と亀（ニータン）であることから“鶴亀決戦”と銘打たれた対戦。ホームでいまだに勝利がない岩手にとっては、再浮上のきっかけをつかむ意味でも、３連敗をまぬがれる意味でも、勝利が欲しい試合となる。

［ 文：髙橋 拓磨 ］","［５－３－２］のミドルブロックを組む岩手に対して、大分はポゼッションを高めながら攻略の糸口を探す。守勢に回る時間帯が多かった岩手だったが、狙いとしていたカウンターで何度か良い形を作り出す。特にボールを奪ったあと、和田 昌士を経由する左サイドへの展開は効果的で、立て続けに左サイドで起点は作ったものの決定的なシュートまでは持ち込めない展開が続いた。一方の大分は、左SBの香川 勇気が高めの立ち位置を取りながら数的優位を維持すると、27分の先制点もここが起点となった。香川から下田 北斗につなぎ、縦パスをライン間で受けた長沢 駿。そこから、スルーパスを受けた野村 直輝がシュートブロックを巧みにかわし、個人技を見せつけゴールを奪う。今季初出場の10番が大きな先制点をもたらした。直後にも野村のシュート、終盤には呉屋 大翔や長沢にもチャンスが訪れたが、大分が１点リードのままハーフタイムを迎えた。

劣勢の岩手は後半開始と同時に３枚代えを敢行したものの、54分には下田に直接FKを決められ、２点のリードを許す苦しい展開を強いられる。しかし、「２点目が入ったことで緩みが出てしまった」（下田）大分に対し、［３－４－２－１］に配置を変更し、途中出場の選手が躍動した岩手が攻勢を強める。71分に色摩 雄貴がクロスに反応して１点差に詰め寄ると、一気呵成にゴールに迫る岩手。80分には中村 充孝が奥山 洋平の決定機を演出すると、88分には深川 大輔がバー直撃のFKでゴールを急襲するなど、再三にわたってゴールに迫ったが、大分がなんとか最後のところでしのぎ切り、辛くも１点のリードを守り切った。過密日程の中、価値ある連勝を飾った大分に対して、岩手はこれで３連敗。ホーム初勝利も持ち越しとなった。

［ 文：髙橋 拓磨 ］","[ 秋田 豊監督 ]
今日もたくさんのサポーターにきていただきありがとうございました。今日はしっかりとリトリートしながらカウンターというイメージどおりの攻撃が途中まで、できていたと思います。ただ、最後のクオリティー、シュートに持ち込むところが反省点だと思います。ボールを奪ってからすぐロストしてしまうシーンが、特に前半の終わりに多かったことが、苦しくなった理由だと思います。

後半、２点目がFKで入ってしまい、さらに苦しくなったんですけど、選手たちは最後まであきらめないメンタリティーを見せてくれて、終盤にチャンスも作りました。ただ、決め切ることができず、１点だけ返して終わってしまったという試合でした。昨季Ｊ１だったチームに対して、あれぐらいの戦いができるというのは選手たちの自信にはなったと思います。戦い方次第で結果が変わってくるというのは分かったと思いますので、次節はしっかりと準備して戦っていきたいと思います。

－－守備面の評価は？
前線でのプレッシングが掛からない、（相手にとって）良い状態で前にボールが入ってしまったという中での失点だったので、ここに関してはまだまだやっていかなければいけない部分がたくさんあると感じています。２点目を取られてはいけない場面だったと思うので、１失点は仕方ないとしても、攻撃の部分でも１点２点と取れるようにしていきたいと思います。","[ 下平 隆宏監督 ]
９連戦がはじまって、リーグ戦で２連勝できたことを非常にうれしく思う。終盤はタフなゲームになったが、選手たちが最後までよく頑張ってくれた。

内容に関してはゲームがスタートしてからプランどおりにいっていた部分もあった。ただ、決定機が何度もあった中でもっと点を取れていれば、ラクにゲームを進められたと思うのだが、なかなか点が入らなかった。前半に１得点。後半も下田（北斗）のFKで得点できて、３点目が入ればもっとラクにゲームを終わらせられたが、失点したところからゲームをバタバタして、最後は危ないシーンまで作らせてしまった。そのへんは反省点として残っているが、まずはこのアウェイの地で勝点３が取れたことを前向きに捉え、また次につなげていきたい。

－－初夏の陽気だった大阪から中２日のアウェイ連戦で、今日は非常に寒かったが、選手たちのコンディションは？
コンディションや移動の疲れなど、初めてくる環境で、スタジアムのこの雰囲気も、どうなるかなとすごく心配だった。ただ、ゲームの入りもよく、自分たちのプレーはできたかなと思う。"
