Round,Hteam,Ateam,Hscore,Ascore,WorL,Preview,Review,H_comment,A_comment
明治安田生命Ｊ２リーグ　第23節,栃木,岩手,1,1,1,"19位の栃木がホームに21位の岩手を迎える一戦。両チームの勝点差はわずかに『１』。下位直接対決となる。

栃木は前節、ホームで大分と対戦。守備でリズムを作りながら進めたが、57分にFKからスキを突かれて失点。終盤まで攻めながらゴールを奪えずにいたが、敗色濃厚となった後半アディショナルタイムだった。６月15日に湘南から育成型期限付き移籍で加入したばかりの根本 凌が鮮やかなミドル弾を決め切り、ドローに持ち込んだ。

時崎 悠監督は根本のいきなりの活躍ぶりを踏まえて、「根本自身もそうだが、なかなか試合に絡めていない選手たちの刺激になったと思う」と語り、暗に奮起を促していた。

この流れを受けて結果をつかみ取ったのが、22日に実施された天皇杯３回戦・横浜FM戦だった。大分戦からスタメン10人を変更して臨んだ試合は、相手にボールを終始握られる展開となったが、GK藤田 和輝を中心とする堅守でゼロの時間帯を更新し続けると、58分に神戸 康輔、そして後半アディショナルタイムにジュニーニョが追加点を奪って２－０で強豪を撃破。この試合をスタンドから見届けた植田 啓太は「誰もが競争意識というフレーズを意識することになる戦いぶりだったし、今後、チームの雰囲気はさらに良くなっていくと思う」と振り返った。栃木はこの空気感を握り締めながら、今節の岩手との下位直接対決に向かう。

一方、岩手もチーム状態は明らかに上向きだ。前半戦では７連敗を喫するなど苦しい時期もあったが、直近４試合は２勝２分。前節はホームで徳島と対戦すると、手堅い守備をベースにゲームを進め、77分に小松 駿太が決勝ゴールを挙げて勝ち切った。

岩手は後半や終盤にかけた得点が多く、秋田 豊監督も「いまは時間が経つほど自分たちにチャンスが来るというサッカーができている」と手ごたえを口にする。岩手は19位・栃木との勝点差を『１』まで詰めており、今節で勝利を収めれば順位が逆転する。

前回対戦は栃木が先制するも、岩手が終了間際に追いつき、ドロー決着だった。両チームともに終盤までプレー強度が落ちないという特徴があり、終了のホイッスルまで目が離せない展開が予想される。下位直接対決で勝利の凱歌をあげるのはどちらか。

［ 文：鈴木 康浩 ］","19位・栃木と21位・岩手の下位直接対決。

栃木は前線に矢野 貴章と根本 凌を並べる２トップの布陣で臨んだが、立ち上がりから攻撃が機能しなかった。中盤がボールを受けても２トップへの足元のパスが多く、相手DFのプレッシャーを真正面から受けてしまうシーンが散見した。

対する岩手はシンプルに背後を狙いながら前進を試みる。21分にはモレラトからのパスで奥山 洋平が抜け出したが、栃木守備陣が間一髪でクリア。だが直後にも中盤のセカンドボールから奥山が背後へ抜け出すと、堪らずカルロス グティエレスが背後から押し倒し、決定機を阻止したと判定されて一発退場となった。

栃木が１人少なくなってからは矢野が中盤の守備に加勢する［５－３－１］のような布陣で進め、根本や矢野が前線でキープ力を発揮してチャンスをうかがう。一方、岩手も中盤に人数をかけながら進入を試みるが、栃木のタイトな守備の前に決定機を作ることはできなかった。

後半も１人少ない栃木が守りを固めながらカウンターを狙い、岩手が攻めあぐねる時間が続く。すると56分、栃木がカウンターから飛び出し、そのまま前へプレッシャーを掛けると、根本がミドルレンジから右足を振り抜いてゴールネットを揺らした。根本は加入から２試合連続ゴールとなった。

ビハインドになった岩手は失点直後にオタボー、中村 充孝、ブレンネルらを投入し、攻撃比重を高める。岩手は中村が栃木のボランチ脇でボールを受けながら、攻撃のリズムを作ろうとするが、勝負のパスにズレが生じて決定機を作り出せない。

だが、岩手は終盤にかけてブレンネルのキープから押し込んでいき、83分、CKから牟田 雄祐が押し込んで同点に。その後も岩手が押し込み、後半アディショナルタイムにはブレンネルが決定機を迎えたが、GK川田 修平がセーブ。その後ゴールは生まれず、試合は１－１で終了。下位直接対決は勝点１を分け合う結果となった。

［ 文：鈴木 康浩 ］","[ 時崎 悠監督 ]
見てのとおり、前半で数的不利な状況を自ら作ってしまったところと、相手のストロングで抑えなければいけないところで失点をしてしまったところで、勝点３をつかめなかったことは非常に痛いと思っています。ただ、選手たちは１人少なくなってからも非常に粘り強く戦っていたと思いますし、選手たちに何か言うのであれば、不満を言うつもりはまったくないです。今日の試合中に発揮できた粘り強さは次につながると思いますし、ここでネガティブなことを言ったらキリがないので、ポジティブなところを持って次に向かっていきたいと思っています。

－－前半は相手が前線の選手のスピードを生かして、チャンスを作っていたと思います。カルロス グティエレス選手が退場になったシーンも背後を狙ってきた形からでした。
相手のラフなボールに対しては、ハッキリと声をかけて対応すればよいところだったし、自分たちでアバウトなボールをアウトにしてしまったり、そういったところでリズムを少し持っていかれた部分があったと思います。

－－根本 凌選手に２試合連続ゴールが生まれましたが、積極性がプラスに出たゴールかなと思います。
そうですね、今日も見てもらったとおり、彼には前線で収める武器があり、前線で時間を作れるということがわれわれが手にした武器だと思います。彼が入ったことによって、攻撃の幅がいろいろと広がってくるなという印象を受けています。","[ 秋田 豊監督 ]
今日もたくさんのサポーターの方に来ていただき、ありがとうございました。今日は前半に相手が１枚CBが退場して、数的優位になったのですが、その優位性を出せなかったところがこういうゲームにしてしまったなと思います。後半に入って仕掛けていったときも、やっぱり消極的なプレーが何回かあったことが、チームに影響を与えてしまったと思います。

ただ、栃木さんは苦しい中でもああいうゴールを取る力は持っていますし、そこでしっかりと食い下がって、１点を取り返してドローに持っていけたと思うので、非常に価値のある勝点１だったと思います。本当に選手たちは全力で戦ったなと思います。

－－相手が１人退場になるところまでの時間帯は、シンプルに奥山 洋平選手を走らせて背後を取るようなプレーからチャンスを作れていました。退場を引き出したプレーも含めて、狙いはうまくいっていたのでは。
そうですね。まさに相手の（カルロス）グティエレス選手のところで背後を取りにいくという狙いがあって、あそこで奥山が並んだら絶対に勝てるという狙いはありました。その意味でそういうシーンが作れたし、彼の良さが出たと思います。

－－相手が１人退場になってからは優位性が生かせなかったとのことですが、後半の途中から中村 充孝選手らが入ってきてからは流れを変えることができたように見えました。
そうですね。相手に対してギャップを作りたかったので、ウチは［４－４－２］に中村のところで起点を作りながらという狙いはありました。彼がピッチに入ると戦術が変わるので、戦術を変えながら、パスを回しながら、あとは中央のブレンネルのところでポイントを作るところでは優位性もありましたし、相手に脅威を与えることができたと思います。もう少しその回数が増えてくれば、得点ももっと生まれたかなと思います。"
明治安田生命Ｊ２リーグ　第24節,岩手,大宮,1,0,3,"20位の岩手と21位の大宮の勝点差はわずかに『１』。残留のボーダーラインを挟んだ両者による“シックスポイントゲーム”は、残留戦線に影響必至のビッグマッチであり、秋田 豊監督、相馬 直樹監督というＷ杯戦士であり、鹿島の黄金期を支えた両指揮官の采配にも注目が集まる。

前節はそれぞれ明暗が分かれる結果となった。岩手は栃木との下位対決に臨み、前半で数的優位になりながらもミスから失点。それでも終盤に同点ゴールを決めて、なんとか勝点１を拾った。対する大宮は金沢とのホームゲームを戦ったが、こちらは中盤でのロストから終了間際に決勝点を許し敗戦。この勝点１の行方が両者の順位を入れ替え、岩手は約２カ月ぶりの降格圏脱出に成功した。

直近のリーグ戦で５試合負けなし。得点力も改善してきた岩手はターンオーバーが功を奏し、明らかに自滅するような試合はなくなった。アグレッシブなハイプレスをベースに、無失点で試合を運びながら、後半の選手交代で攻勢を強める戦い方も確立されており、「いまは自分たちのやるべきことができれば、どのチームにも勝点を取れる試合ができている」と秋田監督も戦いぶりを評価している。

対称的に大宮は監督交代後も１勝２分２敗となかなか上向いてこない。５試合で５失点と守備は持ち直してきたが、一方で奪った得点は『３』。相馬監督の戦術と選手の個性がかみ合ってくれば、地力はあるチームだけに浮上のきっかけをつかむ可能性は大いにある。少しでも早くその最適解を見つけ出し、反攻につなげたい。

［ 文：髙橋 拓磨 ］","ともに中５日で臨む下位直接対決。大宮は前節から３人、岩手は９人を替えて勝負の一戦に臨んだ。

試合開始のホイッスルとともに大宮が右から押し込み、クロスに矢島 慎也がヘッドを見舞えば、岩手も直後に南 拓都のクロスにビスマルクがヘディングでゴールを狙った。立ち上がりから両チームともにゴールへの高い意識をうかがわせる展開となった。

スコアは早々に動く。10分、岩手はCKを得ると弓削 翼のキックにニアの中野 雅臣が頭で合わせた。中野の今季初ゴールで幸先よく先制に成功した。

ビハインドになった大宮だが、25分を過ぎてからはサイドを起点に猛攻を仕掛ける。ペナルティーエリア内に再三進入し、CKも数多く奪ったが、外からのボールは岩手にはね返され続け、シュートには至らない。守備の時間が多くなった岩手だったが、前半を無失点で乗り越えることに成功した。

一転して後半は互いにシュートを打ち合う展開となった。特に決定的だったのは50分のオタボーがペナルティーエリア内で打ったシュートと、63分の矢島によるクロスバー直撃のシュート。いずれもゴールになってもおかしくないシーンだった。

その後、両チームは選手交代で状況の打開を試みる。岩手は鉄板パターンの中村 充孝、ブレンネル、和田 昌士を、大宮は河田 篤秀、小島 幹敏、そして６月23日に特別指定選手として加わった高柳 郁弥を送り出した。

相変わらず大宮がボールを保持する展開は続いたが、ブロックの中には効果的に運べない。１点を追う大宮は再三ゴール前に運ぶが、いずれも岩手のGK松山 健太が立ちはだかり得点には至らない。アディショナルタイムには大宮の富山 貴光がクロスに頭で合わせてネットを揺らしたが、これはオフサイドの判定に。

１点をめぐる攻防は最後まで熾烈を極めたが、岩手が粘り勝った。下位対決を制し、大宮に対しての今季２勝目を挙げ、大きな勝点３を手に入れた。

［ 文：髙橋 拓磨 ］","[ 秋田 豊監督 ]
今日もたくさんのサポーターに来ていただき、ありがとうございました。試合の入りは悪くなかったが、選手たちは暑さもあり、体が重い気がした。そんな中で先制できたのは良かったが、少し引いてしまう悪いクセが出てしまったと思う。後半、メンバーを代えながら盛り返しながら、70～80分くらいは苦しい時間帯だったがDF陣が頑張ってくれて、最後の最後のところで抑えてくれた。内容はともかく、勝てたことが大きい。勝点１と３ではまったく違う。新しいバージョンの粘り強さを見せてくれたと思う。

－－得点シーンについて。
ポール（ビスマルク）がCKを取れたことが大きい。セットプレーに関しては（新沼）泉GKコーチがマネジメントしてやってくれた効果が出た。

－－ゴールを死守した松山 健太の評価は。
正直、マツケン（松山）が今季これだけ試合に出る想像はまったくしていなかった。彼自身が昨季クラブに入って、常に向上心を持って腐らずにやり続けた。そしてチャンスが来たときに結果を残したことが今日の試合にも出ていた。落ち着き、ポジショニング、いろいろな経験値が上がっていることがこういう試合を作ることにつながっていると思う。","[ 相馬 直樹監督 ]
遠く大宮からたくさんきていただきました。一緒に喜べないことは悔しいですし、残念で申し訳ないですが、一緒に戦ってくれたことに感謝したいと思っています。

今日の試合の中でしっかりと戦う、相手を上回るものを見せてほしいと話した。結果負けてしまい、相手を上回れなかったことになると思うが、一つひとつの戦う部分、仕掛けの部分で選手たちは前回よりもかなりやってくれた。これを勝ちに変えるためには私自身、コーチワーク、ベンチワーク含めてもう１段、上げていかなければいけない。選手の今日のがんばりは次につながるものであるし、つないでいきながら勝ちに変えていけるようにしていきたい。

－－システムの狙いと効果について。
いろいろな選択肢の中、この前のゲームを振り返る中で、相手の背中に入っていくのが足りていなかったことと、ゴールへの迫力不足になっていたことは感じていたので、その回数を増やすため、前で時間を作るため、この配置にした。先に失点してしまったが、狙いとしていた攻撃は出せた部分がたくさんある。先に点を取れずにセットプレーから許した形になったが、これを変えるには流れなどいろいろな要素はあるが、変えられるようにしていきたい。"
明治安田生命Ｊ２リーグ　第25節,岩手,琉球,0,1,0,"岩手にとっては前々節から続く“シックスポイントゲーム”３連戦”の最終ラウンド。一方、琉球にとっては監督交代後の初勝利を飾り、巻き返しのきっかけとしたい大事な試合となる。

岩手は６月以降、６試合負けなし。その期間に積み上げた勝点は『12』で、最下位だった順位も19位にまで上げてきた。それでも前節・大宮戦は秋田 豊監督が「80分くらい攻められる展開」と話したように、明らかに押し込まれた。暑さに苦しみ、プレスの勢いが欠如。間延びした中盤を支配された。今節も同じ轍を踏むわけにはいかず、良い流れだからこそいま一度気を引き締めて臨みたい。おそらく、スタメンはほとんどが入れ替わるはずだが、中３日でチームとしての修正をどのように図ってくるか。

琉球は前々節・町田戦からナチョ フェルナンデス監督が指揮。しかし、初戦を落とすと、前節・東京Ｖ戦では手痛い逆転負けを喫した。これでチームとしては５連敗、そして８試合未勝利と苦しい状態が続いている。前節終了後、指揮官は「完成度はまだまだ」とし、クロスへの対応と前半途中から重心が後ろに傾く点を改善点に挙げた。

監督交代後は、ロングボールを使いながら早いタイミングで前のスペースを使う戦い方も印象的な琉球。しかし、トランジションや球際の強さは岩手の武器でもある。岩手としては、秋田監督就任以降積み上げてきた自分たちの土俵で後れを取るわけにはいかない。それがホームであればなおさらだ。下位直接対決となった直近２試合で勝点４を挙げている岩手。琉球との前回対戦では後半に豪快なミドルシュートを２発決めて逆転勝利しただけに、良いイメージを持って臨めるはず。大宮に続き、琉球にも“シーズンダブル”を達成し、勢いを加速させたい。

［ 文：髙橋 拓磨 ］","中２日でのアウェイ戦となった琉球は前節から５人を入れ替え、前節で先制ゴールを奪ったケルヴィンを２トップの一角に据えた。迎え撃つ岩手はターンオーバーを継続し、８人を入れ替えた。

立ち上がりからリズムを握ったのはホームチーム。開始１分でCKを得ると、牟田 雄祐が頭で合わせてファーストシュートを記録する。その後も左の奥山 洋平、右の加々美 登生がサイドをえぐり、クロスからチャンスを作る。琉球はこの試合も早いタイミングで前線に長いボールを入れ、高い位置で起点を作る意図を見せるが、岩手のディフェンスラインの高さ、早いプレスバックに阻まれ、攻撃の糸口をつかめない。ペースは握りながらも、決定的なチャンスには持ち込めなかった岩手に対し、琉球がセットプレーからワンチャンスをモノにする。37分、右からFK。清武 功暉が低い弾道でGKとディフェンスラインの間に入れ、大森 理生が合わせた。

岩手はハーフタイムでブレンネル、中村 充孝という攻撃的なカードを切ってゴールを目指す。そのブレンネルを起点に攻め込む岩手はセットプレーなどからチャンスを作り、再三にわたってフィニッシュへの形は作った。リードの琉球はより徹底して長いボールを相手陣内へ送り、オープンな展開を避けながら時計を進めるが、岩手も前への圧力を強め、両サイドから鋭いクロスを送る。それでも琉球ディフェンス陣は体を張って最後は自由にやらせない。アディショナルタイムにはブレンネルの際どいシュートをダニー カルバハルが素晴らしい反応で阻止するなど、ゴールを死守した琉球は連敗をストップさせ、９試合ぶりの白星。６試合無敗だった岩手に土を付けた。

［ 文：髙橋 拓磨 ］","[ 秋田 豊監督 ]
今日も平日にもかかわらず、たくさんのサポーターに来ていただきありがとうございます。ゲームは立ち上がり良い入りをして、そこで点を取れるかどうかが試合を振り返ると勝敗を分けるポイントだった。クロスの折り返しなど良い攻撃を仕掛けて、もうちょっとのところまでいったが、点を取れなかったことがこういう結果になった。１回だけしか決定機を作らせなかったが、勝負にはこういうこともある。

ただ、失点シーンのFKがどうしようもないゴールだったかといえばどうだったか。一つひとつの競り合い、闘う部分で自分たちが琉球と同じ立場にあったときにしていたプレーがいまはできているのか。そこまで考えると、ちょっとした部分で負けていたと思うし、もう一度確認しながら、焦れずに次のゲームに臨んでいきたいと思う。

－－チャンスがあった中、決め切れなかった要因。
最後の質。クロスを上げるところもそうだし、決定機があった中で、そこでしっかり合わせていくことが必要だと思う。

－－次節に向けて。
フィジカルの強い選手、クリスティアーノをはじめ、外国籍助っ人もいるし、前回４点決められているので、しっかり守備から入りながら勝点を取れるようにやっていきたい。","[ ナチョ フェルナンデス監督 ]
岩手はセカンドボールに強いチームというのは想定どおりだった。それに対して練習で準備してきたことを遂行できていたと思う。前節からの期間のほとんどをリカバリーに費やした。今日は２点目を奪うチャンスもあったので、そこを決めるところ、ゴールに近い位置での精度、そしてゲームコントロールの面は改善しなければならない。ただ、少しずつチームは良くなっている。難しいシチュエーションは今日の勝利でも変わらないが、次の試合で勝点３を目指してやっていきたい。

－－トップに起用したケルヴィン選手を含めた起用の意図、狙いなどについて。
前回の試合で野田（隆之介）が疲弊していたこと、また阿部（拓馬）のコンディションを考えてチョイスした。プレーは悪くなかったし、良く戦ってくれた。引き続き、中に置いても外に置いても改善、成長してくれればと思う。

今日は誰かが特別に頑張ったわけではなく、全員がハードワークして戦ってくれた。そこは非常に満足している。ただ、清武（功暉）のケガが心配。彼は重要な選手。重くならないことを願っている。"
