Round,Hteam,Ateam,Hscore,Ascore,WorL,Preview,Review,H_comment,A_comment
明治安田生命Ｊ２リーグ　第1節,長崎,横浜FC,1,0,3,"Ｊ１昇格への思いを強く抱く両者が開幕から激突する。

トランスコスモススタジアム長崎では、長崎が横浜FCを迎え撃つ。昨季、クラブ史上初めてＪ１の舞台で戦った長崎。最下位でＪ２降格となってしまったが、最下位としては過去最高勝点を獲得するなどＪ１初参戦ながら健闘を見せた。今季の目標は当然、１年でのＪ１復帰。このオフ、チームは大きく刷新された。Ｊ２参入以来、６年間にわたり指揮を執った高木 琢也監督が退任。新たに、リオデジャネイロ五輪日本代表監督を務めた手倉森 誠氏が就任。選手も大きく顔ぶれが変わり、玉田 圭司や角田 誠といった豊富な経験を持つ選手たちがチームに加わった。「全員攻撃、全員守備。一体感のあるチーム」（手倉森監督）をテーマに今季の始動からチーム作りは順調に進んできた。万全の状態で開幕戦に臨めると言っていいだろう。

アウェイでの開幕となる横浜FCは昨季３位。優勝した松本に勝点差１、２位の大分とは同勝点ながら得失点差で下回り、自動昇格を逃した。Ｊ１参入プレーオフでは２回戦で東京Ｖに敗れ、昇格を果たすことはできなかっただけに、今季に懸ける思いは並々ならぬものがあるはずだ。タヴァレス監督が就任して３年目。昨季の主力も残っており、チームとしてのベースはでき上がっている。昨季の悔しさを再び味わわないためにも、スタートダッシュを切りたいところだ。また、田代 真一や乾 大知といった長崎を古巣とする選手がいることもこのカードに彩りを加える。

開幕戦でいきなり相まみえることになった、昇格候補同士。ライバルを蹴落とし、昇格に向けた力強い一歩を踏み出すのはどちらか。

［ 文：杉山 文宣 ］","昨季Ｊ１を戦った長崎と、昨季Ｊ２・３位の横浜FC。開幕戦屈指の好カードは、立ち上がりから横浜FCがボールを握り、攻勢をかけた。

しかし、横浜FCはボールを握っても、ゴール前で粘り強く対応する長崎の守備の前に、思うように決定機を作り出すことができない。逆に長崎は劣勢の時間を耐えてしのぐと、流れを押し戻す。最終ラインからしっかりとボールをつなぐ横浜FCに対し、連動したプレスでミスを誘い、チャンスを生み出していく。得点は生まれなかったが、劣勢で入った前半を「五分五分に戻して折り返せた」（手倉森 誠監督）ことで、チームは落ち着きを取り戻した。

後半に入っても、横浜FCがボールを握る展開は変わらなかったが、長崎のカウンターの鋭さは前半以上になっていった。56分にはCKからイ ジョンホが頭で合わせるが、クロスバーをかすめて得点とはならず。さらに63分には相手のミスから高い位置でボールを持った玉田 圭司がクロス。これはクリアされるが、こぼれ球を拾った島田 譲がシュートに持ち込む。しかし、これもクロスバーを叩き、得点とはならなかった。

互いにチャンスを作りながら得点が生まれないまま、迎えた終盤に試合が動く。長谷川 悠の激しいプレスに激高した田代 真一が報復行為により、退場処分に。ここで得たFKはいったんDFにクリアされるが、ボールが静止していなかったとしてやり直しに。このやり直しのFKからの混戦で角田 誠がシュートを放つと、DFに当たりゴール前での浮き球に。これに反応した長谷川が「力み過ぎずに力の抜けた状態で足が振れた」と、反転からの左足ボレーシュートでゴールネットに突き刺した。

数的不利の横浜FCも最後まで懸命に反撃を試みるが、長崎は得点を許さずにクリーンシートを達成。手倉森監督の下、新体制での初陣を劇的な勝利で飾った。

［ 文：杉山 文宣 ］","[ 手倉森 誠監督 ]
ひさびさの記者会見、勝ってこの席につけて良かったなと思います。手堅いゲームになるだろうなと。でも、ちょっと堅く、大事に入ってしまったのは長崎のほうだった。前半の序盤に横浜FCに攻勢を与えてしまった。そのあとをしのいで、前半を五分五分に戻して、折り返せたなという感じですね。

後半は仕掛ける中で、裏にいかにボールを流せるか。それでもラストパスの精度を欠いた中で、最後はちょっと特別なことを用意しないといけないなと思ったので、大竹 洋平と長谷川 悠でアクセントをつけて、終盤に仕留められたのは良かったなと思います。

何よりも勝点３。昨年度、悔しい思いをして降格したわれわれが今季は歓喜に包まれたいと。まず一発目に、長崎のサポーターの皆さんと勝利を分かち合えたのは良かったです。あとホームで（リーグ戦の）20回、分かち合えればなと思います。

－－６年ぶりのＪリーグでの指揮。感想は？
試合中は簡単に点を取らせてくれないなと思いましたよ、久しぶりなんでね。ただ、簡単に失点もしたくないなという思いも自分の中にあってね。矢継ぎ早にゲームの終盤に交代を仕掛けていったときに、やっぱり一戦一戦、悔いの残らない戦いをしたい。戦略もシステムも変えていきながら進んでいった中で、報われたゴールが90分だったんですけど、今季の先制点、俺自身の監督業のひさびさのゲームで、90分も待たされたなと思いました（笑）。何より、サポーターが90分待ってくれたのでね。僕と同じ思いだったと思います。","[ タヴァレス監督 ]
前半はすごく良い時間帯もあったというふうに思っています。そのあと、少し集中を欠いた時間もあったと思っていて、それは長崎さんも同じようにそういう時間があったと思っています。前半を終えて、後半に向かう前にマーキングの修正を少しして、その修正によって、後半のほうが良いパフォーマンスができたと思っています。しかも、チャンスを２、３度と迎えることもできました。特にイバなんですが、もう少し彼の特長を生かせれば、ゴールにつながったと思っています。

チームは戦術的にもフィジカル的にも良い状態で開幕戦を迎えられたと思っていて、選手たちも新しい選手を含めて、チームは順応していって、段々と良いチームになってきたと思っています。田代（真一）の退場があって、チームは少し集中を欠いてしまったところはあったと思います。しかも、FKのやり直しでさらに集中を欠いてしまって、最後決められてしまいました。

－－前半は前線の２人、イバとレアンドロ ドミンゲスがかなり高い位置を取っていたが、それは長崎の最終ラインを下げる狙いだったのか。
特にそこまで大きな意図というものではなかったんですが、自分たちの中盤が少し前めにポジションを取っていたので、その結果、レアンドロが自由になって、前のほうにポジションを取ったんだと思います。彼はこの準備期間で２試合ほど練習試合をこなしましたが、すごく良いコンディションにあると思います。"
明治安田生命Ｊ２リーグ　第2節,福岡,長崎,0,0,1,"福岡がファビオ ペッキア監督、長崎は手倉森 誠監督と、ともに新指揮官を迎えた新生チーム同士の戦いは、“バトルオブ九州”ということもあって大いに盛り上がりそうだ。

福岡にとっては今季初のホームゲームとなるが、スタジアムが本来のホームであるレベルファイブスタジアムではなく東平尾公園博多の森陸上競技場となる。これはレベスタが９月から始まるラグビーＷ杯の会場の１つで、そのための芝の養生期間で使用できないための措置。慣れないスタジアムではあるが、さまざまなイベントを絡めて来場を呼びかけているので、福岡のホームと言うにふさわしい雰囲気になることは間違いない。

開幕戦で琉球に１－３で敗れた福岡だが、今季から掲げる攻撃的なサッカーを表現できたという点をチーム内では前向きに捉えている。もちろん、３失点を喫したことからカウンターに対するリスク管理や、今季のベースとなる前線からのプレッシングが十分ではないという反省点があることも事実。一方の長崎は新加入の長谷川 悠が90分に決勝ゴールを挙げ、ホームでの開幕戦で劇的勝利を収めたが、攻撃面では個の力は十分もグループとしての推進力や迫力は不十分だったという反省点が残った。

互いに収穫と反省点があった開幕戦を終えて臨む今季２戦目は、今後の戦いを見据える上でも大事なものとなる。福岡が連敗阻止と今季初勝利によって前向きなエネルギーを作り出すのか。それとも長崎が連勝を収めて一気に勢いに乗るのか。注目の一戦はレベスタではなく博多陸での開催となる。

［ 文：島田 徹 ］","ラグビーＷ杯の会場となるレベルファイブスタジアムが芝の養生で使えず、今節を含めてしばらくは東平尾公園博多の森陸上競技場でのホームゲームが続く福岡だが、会場変更の積極的な告知も効き、さらに“バトルオブ九州”ということで長崎からのサポーターも多く詰めかけ、12,000人を超える観客の中でのホーム開幕戦となった。

スタジアムの熱気に押されるように、前半の主導権を握ったのは福岡だった。縦に速い攻撃をベースに、足元とスペースへのパスをうまく使い分けながらボールを保持して、チャンスをうかがった。しかし、長崎はしっかりとしたブロックを敷いて粘り強い守備を披露。特に角田 誠とチェ キュベックのCBがクロスにしっかりと対応してゴールを許さない。

後半は逆に長崎ペースで試合は進む。福岡がビルドアップする際の守備のパワーを上げて、ボール奪取やインターセプトの頻度が高まり、そこから効果的なショートカウンターを繰り出す。しかし、今度は福岡が粘り強い守備でしのぐ。

得点が欲しい両チームは、交代策による打開を狙う。福岡は城後 寿に代えて前節は右SBで先発した石原 広教を２列目に送り込み、石津 大介を１トップに、その後も交代と配置換えを繰り返し、長崎も澤田 崇に代えて大竹 洋平を、玉田 圭司に代えて前節決勝ゴールを挙げた長谷川 悠を送り込む。これで互いに攻撃は活性化して、激しいカウンターの応酬となったが、どちらも決め切ることができず。スコアレスのまま勝点１を分け合った。

［ 文：島田 徹 ］","[ ファビオ ペッキア監督 ]
前半は良い試合運びができて、長崎を押し込むことができました。おそらく前半、長崎のチャンスは１回だけに終わったと思います。後半は、われわれの選手たちの距離が広がって（バランスが）おかしくなって、そこで長崎にチャンスを作られてしまったけれども、われわれも同じようにチャンスを作った。勝てなかったことは悔しいが、苦しい中でも90分集中して戦うことができたので、選手たちが見せてくれたパフォーマンスを評価しています。

－－攻撃に関して、どのように感じましたか？
非常に良い攻め方をしたが、ペナルティーエリアに近いところでもう少し、スピードを出して、パスを出してほしかった。そうすれば、もっと良いチャンスは作れたかもしれません。

－－前節・琉球戦の敗戦を受けて、「リスク管理を意識したい」とお話していましたが、今日はどうでしたか？
前半に関しては、相手に１回しかチャンスを与えなかったということは、リスク管理ができていたということ。それを90分続けられるようにしていかないといけません。","[ 手倉森 誠監督 ]
アウェイで勝点１、０－０。今日のゲーム内容だったら、それに謙虚に満足しなければならないだろうなと。前半、福岡の勢いと攻勢に対して、守勢に回らされた。後半は少し、一進一退に持ち込めたかなという展開で、後半だけ考えれば、どちらに勝点３が転がり込んでもおかしくないような試合展開。ただ、お互いに取れずに０－０というあたりが“九州ダービー”、あと、福岡のホーム開幕戦だったというところだと思います。

無敗と無失点は続いているので、このまま続けていけるようにしぶとくやっていくだけだっていう話はいま、選手たちにしてきました。ルヴァンカップとの並行した戦いになりますけど、連戦が続けば疲れるのではなくて、たくましくなれるチャンスだという話はしています。今日、ホームの福岡にこれだけ攻められても焦れずにしのげたというタフさを自信にして、進んでいければなと思います。

－－試合前、ハーフタイムに選手たちに話していたことは？
まず、激闘だな。それを覚悟しようという話をしました。それは今節に至るまで、福岡が開幕戦をアウェイで落としているということ。あと、福岡のサポーターの煽りから選手たちはアグレッシブに来るという話をしました。受けて立つわけじゃないけど、そういったものを想定して戦おうという話をして、そうなったときに相手の力を利用したサッカーになるけど、カウンターを何度か繰り出せた。あそこで仕留められていたら、したたかなチームになれるよっていう話をしていて、後半はそういう展開に持ち込もうという話をして、送り出しました。前半、福岡は勢いを持って戦ったぶん、後半、少しペースダウンしたんだろうなと。そこに対して、自分たちも互角にやれるようになったところを、そうなるという話をハーフタイムにはしました。"
明治安田生命Ｊ２リーグ　第3節,長崎,水戸,0,1,0,"長崎は前節、アウェイで福岡との“九州ダービー”に臨んだ。立ち上がりから福岡の攻勢にさらされる展開となったが、粘り強い守備で対応。後半にはカウンターから好機を作り出したが、ゴール前での精度を欠き、得点は奪えずにスコアレスドローに終わった。

一方の水戸は前節、ホーム開幕戦で栃木との“北関東ダービー”に臨んだ。立ち上がりから迫力ある攻めを展開して栃木を圧倒すると、前半に清水 慎太郎の得点で先制。後半にも茂木 駿佑、前 寛之が追加点を奪い、終わってみれば３－０の完勝。内容でも15本ものシュートを浴びせた上で栃木のシュートを１本に抑えるなど会心のゲームを展開し、開幕から無失点での連勝を達成。この結果を受けて、首位に浮上した。

開幕からの２試合を１勝１分とまずまずのスタートを切った長崎だが、２試合とも立ち上がりから相手の攻勢にさらされているように、試合の入りに課題を残している。また、２試合連続で無失点を記録しているように守備での粘り強さは光っている一方で、得点は１点のみ。ゴール前でのアイディアや精度、カウンター時の連係のすり合わせがまだまだ不足している状況だ。

６日にＪリーグYBCルヴァンカップを戦っている長崎だが、先発はすべて入れ替えていただけに体力的な影響はないだろう。好調な水戸の攻撃陣をこれまでどおり粘り強い守備で抑えた上で、しっかりとチャンスを仕留める決定力が求められる。ルヴァンカップでは吉岡 雅和や畑 潤基といった新たな選手が活躍し、勝利をつかんだ。さらに高まったチームの総合力を生かし、ホームでの連勝を目指す。

［ 文：杉山 文宣 ］","開幕から互いに無失点と好調なチーム同士の対戦。まず、試合の入りから主導権を握ったのは首位の水戸だった。ポゼッションを高めながら長崎を自陣に押し込んでいくが、長崎も中央突破は許さず、サイドからのクロスに粘り強く対応していく。34分にはCKからイ ジョンホがヘディングシュートを放つが、枠に収め切れない。39分には水戸に決定機。高い位置でボールを奪った黒川 淳史がシュートを放つが、ニアへの鋭いボールはGK徳重 健太が鋭い反応で阻止。スコアレスのまま、前半を折り返した。

後半に入ると、互いにチャンスを作れずにきっ抗した展開に。そんな中、１つのミスがスコアを動かす。島田 譲が強引にミドルシュートを狙いにいくが、水戸のブロックに阻まれる。これが中央にこぼれたところで水戸のカウンターが発動。清水 慎太郎が右サイドに展開し、茂木 駿佑がクロスを中央に入れると、飛び込んだ清水がしっかりと沈めて水戸が先制に成功する。反撃に出たい長崎は交代カードを切って活性化を目指すが、水戸の守備ブロックの前にボールを持たされる展開でチャンスをまったく作り出せず。結局、後半のシュート数はゼロに終わっており、今季初黒星を喫することになってしまった。

開幕からすべて無失点で３連勝、暫定ながら首位をキープした水戸だが、試合後、「自信と過信は紙一重。足元を見つめてやるべきことをやっていきたい」と茂木は話した。一方、敗れた手倉森 誠監督は「長崎も（守備ブロックを）組んだ相手を崩し切れなければ、ちょっと上昇が難しくなりかねないので、早急にやっていきたい」と課題を口にしていた。

［ 文：杉山 文宣 ］","[ 手倉森 誠監督 ]
大事に、慎重にいって、大胆さを欠いたなという試合になってしまいましたね。水戸のスタイルは分かり切っていた中で、カウンターのケアというときに、カウンターのチャンスをわれわれが与えてしまっている。あと、ゲームプランのところで、やっぱりここ１、２戦、無失点でずっときて、なんとかゲームを保てたチームが、先制されたゲームで自分たちのミスが増えてしまうという悪循環を経験してしまった。選手たちにはいまの力はこれなんだという話はしましたし、いろいろな初めてを経験したなという話を（しました）。失点も、敗戦も、あとコンディショニングにちょっと、アクシデントによる交代で３枚を使うという。そんな中で一度、負けた中でスッキリしようと。イーブンに戻された状況でもう１回立て直さなければいけないという話はチームにしてきて、これを良い薬にしようという話はしたんでね。立て直すためにこれからやっていくだけです。

構えられたときの大胆さ。シュートで終わる、スルーパスで終わる、クロスで終わるというところ。ホームだったら、もっと自信を持ってやらないといけない。そこを慎重になり過ぎたのがアダになって、実は打っちゃいけないタイミングのときのシュートがカウンターになっている。これは何かのメッセージだろうと思うから、教訓にして進みたいと思います。

－－香川 勇気選手を投入して、亀川 諒史選手を右に回しました。両サイドからバランスよく攻めたいという狙いだったと思いますが、評価は？
勇気を今季、リーグ戦で初登録した中で、サイドの活性化は絶対にどこかでやらないといけないというプランで入れていました。ただ、本当は３バックのウイングバックのプランを温めていたんですけど、代えないといけない状況になったのが（チェ）キュベックだった。３バックが不可能になった状況でシステムを変えずに。それでも挽回し切れるかなと思ったんですけど、その段階ではチームがちょっと、コンディションが落ちてきた選手が多過ぎた。それでも、もっとシンプルに考えていれば消耗もなかったのかなと思いますけど、ちょっと今日は頭も体も疲れただろうなと思います。","[ 長谷部 茂利監督 ]
攻守にきっ抗したゲームだったと思います。２節を終わった段階ですが、両チームともに無失点という状態でした。その中で１得点をして、それが勝利に結びつきました。理想を言えば２点目、３点目を取りたかったのですが、それほどチャンスを作れない中、勝てたことを非常にうれしく思っています。

－－長崎の守備組織はかなり堅固だったと思います。どのように点を取ろうというイメージを持っていましたか？
方法はいくつもあると思います。でも、どれを実行に移しても簡単には点を取れないとはじき出していました。ただ、偶然ではありますが、カウンターは長崎さんが得意なプレーです。その長崎さんの得意なプレーを私たちができたことを不思議に思うところがありますが、そういう形で点を取ることができました。"
