Round,Hteam,Ateam,Hscore,Ascore,WorL,Preview,Review,H_comment,A_comment
明治安田生命Ｊ２リーグ　第42節,新潟,長崎,2,1,0,"いよいよ最終節。11位の新潟はデンカビッグスワンスタジアムに12位の長崎を迎える。

ともにＪ１昇格もＪ３降格もないが、注目されるのは両チームのエース同士の得点王争い。27得点で首位のレオナルドと、22得点で２位の呉屋 大翔が対戦する。

レオナルドと呉屋はともに明治安田Ｊ２第38節を最後に得点から遠ざかっている。レオナルドはあと３点を積み上げてライバルを突き放し、30ゴールに乗せることを狙うが、あくまでチームのため。「Ｊ１昇格のチャンスがなくなったことは本当に残念だが、最後まで勝利を求めて戦い、個人的なタイトルをサポーターと喜びたい」と、サポーターのために勝利とゴールを誓う。

新潟は22日現在、吉永 一明監督と、クラブのレジェンドである野澤 洋輔、矢野 貴章、小川 佳純の今季限りでの契約満了を発表している。

吉永監督は４月、片渕 浩一郎前監督の解任を受けて、新潟のアカデミーダイレクターから監督に就任。レオナルドや本間 至恩ら若手選手を積極的に起用して攻撃力を高めてきたが、Ｊ１昇格はかなわなかった。

野澤は2000年から2008年に新潟に所属。2003年のＪ１昇格に貢献し、明るいキャラクターでサポーターにも愛された。今季、新潟シンガポールから11年ぶりに新潟へ復帰。ここまで公式戦の出場機会はないが、「ビッグスワンでやることを目標にやってきた。変わらずに準備する」と今週の練習に臨む。

矢野は2006年から2010年、2012年、2017年から2019年と、三度にわたり新潟でプレーした。日本代表として2010年の南アフリカＷ杯に出場。新潟からは初めてのＷ杯出場選手となった。ハードワークする姿勢は新潟の象徴的存在だった。

小川は2017年８月に新潟へ加入。昨季は主将も務めた。経験豊富なサッカーIQの高さで後輩たちに多くのものを与えた。

新潟はデンカビッグスワンスタジアムでは６試合負けなし。勝利すると、2013年以来のホーム５連勝となる。最後は笑顔で功労者を送り出したい。

［ 文：野本 桂子 ］","ともにＪ１昇格もＪ３降格もない中で、今季限りで退団が決まっているレジェンドを送り出すためにも、勝利だけを求める試合となった。

新潟の先発は前節と同じ11名。レオナルドはＪ２得点王がかかる一戦となった。ベンチには、退団が決まったレジェンド２名、野澤 洋輔と矢野 貴章が入った。

一方の長崎は、ケガ人などの影響で前節から先発６名を変更。今季限りでチームを去る髙杉 亮太が５試合ぶりのスタメンをつかみ、角田 誠とCBコンビを組んだ。

前半はボールを握って押し込んでくる長崎に押し込まれる時間が続く新潟。それでもゴール前で粘り強く耐え、前半を０－０で折り返す。

すると後半、先制したのは新潟。左サイドをシルビーニョが突破してペナルティーエリア手前に折り返すと、レオナルドが渡邉 新太とのワンツーでゴール前に抜け出して今季28点目を決める。19日に第２子となる次男が誕生した舞行龍ジェームズを祝う、ゆりかごパフォーマンスが行われた。

56分に長崎にビッグチャンス。米田 隼也の縦パスがDFに当たったこぼれ球を髙杉がダイレクトで突き刺すが、これは惜しくもオフサイドとなる。

すると61分、シルビーニョの突破で得たCKを本間 至恩が蹴ると大武 峻がヘディングでゴール。自身の27歳の誕生日を祝うゴールとなった。

長崎は63分に呉屋 大翔を投入。呉屋の積極的な守備からカウンターでチャンスを作るが、新潟は粘り強く守る。

76分、新潟はシルビーニョに代えて矢野 貴章を投入。チームメートは矢野にゴールを取らせようとボールを集めるが、少しバランスを崩してしまい、88分に米田に１点を返されてしまう。

アディショナルタイムは５分。長崎の攻撃を早川 史哉が２連続で阻止すると、２－１で野澤 洋輔が投入される。新潟でトータル10シーズンを過ごしたレジェンドが投入されると、スタジアムは大きく沸き上がった。

そのまま新潟は逃げ切り、２－１で勝利。レオナルドは昨季のＪ３得点王に続いてＪ２得点王に輝き、吉永 一明監督、野澤 洋輔、矢野 貴章、小川 佳純、チョ ヨンチョルという退団する選手を勝利で送り出すことができた。

一方で長崎は悔しい敗戦。12月21日に控えた天皇杯準決勝・鹿島戦に向けて仕切り直す。

［ 文：野本 桂子 ］","[ 吉永 一明監督 ]
最後の試合をホームでやれることになって、この試合をどう位置づけるか。当然未来に向けてというところもあるんですけど、僕が来年やるわけではないという中で、本当にそれぞれがそれぞれの未来に向かって、このゲームで何ができるかというところにフォーカスした。ただ、やってきたこと以外のことはできませんので、これまで積み上げてきたものを出すということで準備してきました。

長崎さんも個の特徴ある選手、力のある選手がいましたので、そこを消しながらチームとして戦うところで前半は悪くはなかったんですけど、ちょっとしたズレやミスが目立った。後半、そこが合ってきたところで得点が生まれた。最後、押し込まれたところをもう１つしのげれば良かったかなというところがあります。

何よりも、90分で勝点３を取るということをチームとしてやってくれたことは大きいし、彼らの成功体験として、今後生かされればいいと思います。本当に勝って良かったです。16,000人を超えるサポーターがこの状況でも来てくれることは普通ではないと思っていますし、その人たちに勝利を届けられたこと。最後にそれができたことが一番大事なことです。これをまた、おのおのが持ち帰って、次のステップで生かしてくれればと思います。

－－野澤 洋輔選手の起用について。あの展開で出すのは異例かと思うが。
あの場面だからこそ、野澤 洋輔ですよね。僕は（新潟シンガポールで）２年間一緒にやっていますし、そこに躊躇はなかったです。入れるかどうかの判断は試合の展開を含めて考えるべきところはありました。

ただ、彼のユニフォーム姿はこれからそんなに見られるものではないですし、引退試合を開催する条件に試合数が満たされていないとか、いろんなことも頭にあったので、彼の姿を新潟の人たちに見せるのは僕の義務かなと思っていました。負けている状況で入れるのは彼に失礼だし、本当に良い形で立たせてあげられた。それを作ったチームメートが素晴らしいと思います。

－－送り出すときはどんな言葉をかけたか？
言葉はいらないですね。もうそういう関係じゃないので。やることは分かっていると思います。それがプロの選手だと思います。","[ 手倉森 誠監督 ]
最終戦で勝利を飾りたいので、みんなでまとまりを持って戦おうと臨みました。ゲームは攻勢でこっちのほうがボールを握って、クオリティーを示せた気もしています。残念なところでノーゴールになったり、PKも流されたりとか、最後の最後まで不運が重なったゲームになってしまった。それでも選手は切らすことなく、最後までしっかりと押し込んで展開していたので、われわれの意地だったと思うし、実際負けていないゲームだったと思います。何よりも2019年がこういう終わり方。ものすごい腹立たしい気持ちを抑えて、年内まだ（天皇杯が）あるので、やっていきたいと思います。

－－天皇杯・鹿島戦に向けて。
まずクラブの歴史を塗り替えている大会で、個人個人の気持ちよりも、クラブや長崎市民、県民の思いを持っていって。リーグ戦で悔しい思いをかなりさせたぶん、長崎県民を喜ばせる思いで、みんなそこの気持ち１つでやっていければと思います。"
明治安田生命Ｊ２リーグ　第1節,長崎,栃木,1,0,3,"Ｊ１昇格を懸けた長いシーズンが幕を開ける。トランスコスモススタジアム長崎では長崎が栃木を迎え撃つ。

2018年以来のＪ１昇格を目指す長崎は、昨季の明治安田Ｊ２で12位。手倉森 誠監督を新たに迎えて１年でのＪ１復帰を目指したが、１年を通じて戦い方が定まらずに昇格レースに絡めなかった。失意のシーズンを受けて、今季は10人の選手が新たに加わった。守備陣には二見 宏志、フレイレとＪ１から屈強なDFを獲得。前線にはブラジル１部リーグで確かな実績を誇るルアンを迎え入れた。また、戦術面でも今季は３バックの導入にもトライしている。昨季の４バックと合わせてチームは幅を広げている。練習試合でも勝利を重ねており、チームは良い状態で開幕を迎えられるはずだ。

一方の栃木は昨季のＪ２で20位。シーズンを通して下位に低迷したが、ラスト４試合で勝点10を獲得するなど猛チャージを見せ、最後は勝点で並んだ鹿児島を得失点差で上回り、奇跡的な残留劇を演じてみせた。田坂 和昭監督が指揮を執って２年目となる今季は14人の選手が新たに加入（期限付き移籍からの復帰を除く）。昨季はシーズン終盤にチームとしての戦い方が明確に定まったことがＪ２残留へと結びついた。今季はそのベースを維持しつつ、躍進を目指すことになる。

長崎はＪ２に参入した2013年以降、開幕戦は４勝１分２敗、Ｊ２に限れば４勝１分１敗と高い勝率を誇っている。また、長崎のサポーターが楽しみにしているのは髙杉 亮太の存在だろう。長きにわたって長崎でプレーし貢献してきた髙杉は昨季限りで契約満了となり、今季から栃木へ。長崎サポーターからの愛情も深い髙杉がいきなりかつてのホームのピッチに立つかどうかはこの試合の大きな注目ポイントだろう。

［ 文：杉山 文宣 ］","長崎にとっては昨季ホーム最終戦で苦杯を舐めた栃木を迎えての開幕戦。立ち上がりからボールを握り、攻勢をかける。栃木は耐える展開での入りとなるが、この時間帯をしのぐとカウンターから反攻に転じる。10分にはショートカウンターから矢野 貴章がシュートを放つ。これはブロックされたが、ここからは栃木がセットプレーを中心に押し返し始める。ただ、先制したのは長崎。22分、CKを富樫 敬真がニアでそらす。ファーに流れたボールに反応したフレイレがこれを押し込んだ。先制を許した栃木も27分、溝渕 雄志のクロスに矢野が頭で合わせるがこれは枠外。長崎は30分にCKから角田 誠が決定機を迎えるが、これは川田 修平がファインセーブで阻止。前半は長崎リードで折り返した。

後半に入ると立ち上がりはやや長崎が押し返すものの、60分過ぎからは栃木が押し込む展開に。「後半の15分くらいから２点目を奪いにいくメンバー交代を考えられたんですけどやめました」と手倉森 誠監督が言うように、長崎は早めに逃げ切りシフトへ移行したことも影響した。61分にはロングスローから田代 雅也がボレーシュートを放つが、これは高木和 徹が阻止。69分には途中出場の韓 勇太のクロスに明本 考浩が合わせてゴールネットを揺らすが、直前にファウルがあったとして得点は認められず。その後も栃木はロングボールを中心に長崎を押し込むが、前にかかるぶん、カウンターを浴び、押し戻される時間も増え始める。結局、栃木は押し込みながらもフィニッシュの質を欠き、長崎がセットプレーでの１点を守り切り、開幕戦での勝利を手中に収めた。

苦しい試合展開だったが「勝ったということがすべて」と富樫が話したように、何よりも欲しい勝点３を長崎はモノにした。

［ 文：杉山 文宣 ］","[ 手倉森 誠監督 ]
ホームでの開幕戦で簡単なゲームではないと、これまでの試合も簡単なゲームはないと。ただ、難しく考えるなと。キャンプから今年こそはという思いでやってきたことを出せればいいと話しましたが、硬くなったなと（苦笑）。

前半の、流れではなくセットプレーからの１点が決勝点になって勝てたゲームでした。栃木のダイレクトプレー、ロングボールに少し手を焼かされた。その中でも守備の部分で、最後の最後でしのげたのはたくましく戦えた部分だなと思います。ただ、攻撃ではちょっと相手陣地で最後のもう一手、二手のパスのところで簡単に相手に渡し過ぎたなというところは課題だろうなと思います。ただ、始まったばかりなのでそこは試合をやるにつれ高まっていく部分だろうなと思いますから。何はともあれ、キャンプ中にサポーターの皆さんの期待を膨らませて、負けるわけにはいかなかったので勝点３を届けられて本当に良かったなと思います。

－－今日のスタメン構成で重視した部分は。
去年までのメンバーと今年入ったメンバーの融合は、間違いなく今年の体制を見て何かチームは大きく動き出すという覚悟を思ったときに、思い切ってスタメンもサブの構成もこれまでの選手と新加入と混ぜてお披露目するときだなと思ってそれをやりました。

－－最後に毎熊 晟矢選手を投入したのはプロの世界に早く慣れさせるためだったのでしょうか。
一度、場を踏んで短い時間でもこの雰囲気に慣れて今年、われわれが目指すものへの自覚というのがより深まればなと思って大卒２人を思い切って使いました。

－－ボールを保持したい中では思うようにできなかったが。
ところどころで、ボールの動かしはやってきたとおりのことをやれているなと。そういう時間を覚悟できるようになればいいなと。そこに対してはそこで渡してしまうの？っていうところがあるので奪い返せない。奪い返せる状況というのは仕掛けのパスだったり、相手のオーガナイズを崩した状況でのパスが出たときや、ドリブルで仕掛けたとき。そこに対して、最初に先制したのもあったかもしれないですけど、慎重になっていたなという気がする。そのへんは、大胆にやっていけるようになるには今日の勝点３が必要だった。今日は僕自身もリズムチェンジして後半の15分くらいから２点目を奪いにいくメンバー交代を考えられたんですけどやめました。１－０の逃げ切り、今日はそれしか考えていませんでした。","[ 田坂 和昭監督 ]
結果は悔しい結果です。やるべきことができた試合でした。ここに来たサポーターに開幕戦勝利を届けたかったのですが、届けられずに残念です。キャンプを通じてやってきたことはほぼほぼ出せたと思いますが、まだまだできたというのが私の感想です。それは何かといえば、守備のところでもっとプレッシャーを掛けられるし、もっと高い位置から引っかけられるんじゃないかと。攻撃のときも、カウンターのときにもっと走って人数をかければ崩せるシーンも出てきたと思います。

ただ、いま持っているものを出して選手たちは非常によくやってくれました。後半は点を取るために前から行って良いチャンスを作っていました。なかなかゴールを奪えなかったのは課題ですが、また次に向けて精度を上げていくこともそうだし、走力の質も上げていきたいと思っています。次はダービーなので、しっかり勝てるように走って、勝てるように準備したいと思います。

－－勝負を分けたのは最後の質の部分でしょうか。
そう言ってしまえば簡単ですが、われわれはチャンスを多く作っていましたし、逆にピンチと言える場面は記憶するかぎりはほとんどなかった。質といえば質ですが、われわれはチャンスをたくさん作って決めることが課題になると思います。確かに勝負を分けたのはリスタートの質だったと思います。"
