Round,Hteam,Ateam,Hscore,Ascore,WorL,Preview,Review,H_comment,A_comment
明治安田生命Ｊ２リーグ　第40節,東京Ｖ,長崎,0,2,3,"Ｊ１復帰を目標に掲げながら今季も昇格を逃して12位に沈む東京Ｖが、味の素スタジアムに３位の長崎を迎える。長崎と首位・徳島の勝点差は『７』で、長崎が負ければ徳島は自らの結果にかかわらずＪ１昇格が決まる。２位・福岡との勝点差は『２』だが得失点差は長崎が『６』上回っており、長崎が勝ち、福岡が引き分け以下なら長崎が２位に浮上する。

東京Ｖは前節、町田に０－１の敗戦を喫し、直近の４試合勝ちなし（２分２敗）となった。「相手を圧倒して圧勝する攻撃サッカー」（永井 秀樹監督）を掲げるチームが、攻めても攻めてもシュートが入らず相手のカウンターやセットプレーに沈んだというなら許容範囲にしても、シュート２本に終わって逆に相手には13本のシュートを許したことに、「反省すべき試合」と指揮官は肩を落とした。

対する長崎は前節、山形に前半は圧倒されながらも無失点でしのいで後半に盛り返し、終盤にCKから虎の子の１点を奪って勝点３を手にした。この試合に限らず、長崎の試合は後半に動くことが多い。前半は我慢強く戦って悪くても最少失点に抑え、終盤で勝ち越すのが長崎の勝ちパターンと言える。

前回対戦は東京Ｖがボールを握って攻めたが、長崎もカウンターとセットプレーで脅かしながら手堅く試合を運んでスコアレスドローに終わった。しかし、今回は長崎にとって昇格のためにどうしても勝点３が欲しい試合。第３登録期間に期限付き移籍で獲得したエジガル ジュニオもすでに４得点と攻撃面でチームをけん引しており、Ｊ１昇格のためリスクを負ってでも攻勢を強めてくるだろう。

東京Ｖとしては前節の反省点をしっかり改善し、昇格を目指す相手に一泡吹かせたいところ。長崎が３位に終わればすなわち来季は昇格候補の一番手となるわけで、来季につなげる上でもこの試合に勝っておくことの意義は大きい。長崎からはヴィヴィくんが来場して東京Ｖ・リヴェルンとの“あざといマスコット”の邂逅も見られるが、ピッチ上では熱い戦いで前回ドローの決着をつけてほしいところだ。

［ 文：芥川 和久 ］","３位で昇格を争う長崎が立ち上がりからペースを握った。出足の速さと球際の強さで上回りセカンドボールを回収すると、氣田 亮真が左サイドから積極的に仕掛けてチャンスを作り、押し込んだ。序盤を過ぎて東京Ｖもハイプレスからボールを奪い保持する時間を増やせるようになったが、しっかり守備ブロックを作ってアプローチする長崎の中盤を良い形で越えられず、ペナルティーエリアに入る場面は少なかった。

長崎は27分に氣田の仕掛けからルアンのシュートによってCKを得ると、キッカーは秋野 央樹。左足から放たれたボールに対し、角田 誠が、東京Ｖの馬場 晴也、藤田 譲瑠チマが競りかけるのをものともせず、28分に貫禄のあるヘッドで押し込んだ。勢いに乗る長崎は32分、高い位置でボールを奪うと、氣田がドリブルでペナルティーエリアに進入。そのこぼれ球を大竹 洋平が右足で浮かせ、左足のボレーでゴールに流し込む。アウェイチームがあっという間に２点のリードを奪った。

東京Ｖも前半アディショナルタイムに端戸 仁が長崎DFのパスミスを奪ってGKと１対１になりかけるが、シュートは必死に戻った米田 隼也がブロック。

前半終了間際のチャンスを逸したホームチームは、後半開始から山下 諒也、井出 遥也を投入して、前半ほとんど機能していなかった左サイドのテコ入れを図った。

２点リードしていることで、長崎は引いて守りを固めてカウンターを狙うことに。長崎を押し込んで試合を進めるものの、集中した守備をなかなか崩すことができない東京Ｖは、66分に藤田のクロスを奈良輪 雄太が折り返して若狭 大志が飛び込むが、秋野が体を寄せて枠内に打たせない。88分、奈良輪のクロスに山下が飛び込んだ場面も、体を投げ出した二見 宏志が自由に打たせなかった。後半アディショナルタイム、ペナルティーエリア内フリーで放った井出のシュートも枠を外れ、東京Ｖは最後までゴールネットを揺らせず。長崎が昇格に向けて貴重な勝点３を手にした。

［ 文：芥川 和久 ］","[ 永井 秀樹監督 ]
長崎さんはまさに昇格が懸かった中で、非常に高いモチベーションで戦ってくると想定していました。前半は、相手のゴールキックも含めて、ビルドアップを前からハメにいきたいという狙いの下、選手たちはよくやってくれたと思います。まずまずプランの実行はできたが、非常に悔しい反省すべきところは、セットプレー１つでやられたことです。もっと言えば、自分たちの掲げているスタイル、これだけ攻撃サッカーを明確に打ち出しているにもかかわらず、１失点しただけで下を向いてしまう。そこは来季も見据えた中で、より強くなっていかなければいけない一番大きなところだと思います。

２失点目に関しては自滅というか、気の緩みと言ってしまえばそれまでですが、ホイッスルが鳴るまでプレーをやめない、切らないのは当然で、そこにも非常に大きな反省点があります。

それ以外のところではまずまずやれたと思うが、われわれのボール保持、われわれがやりたいこと、その最優先であるゴールからの逆算という部分が特に前半は乏しかったのが非常に反省すべきところで、また次に向けて選手たちと改善していかなければならないと思います。

後半は選手交代していく中で、より点を取りにいく強い気持ちを少なからず見せられたことは、選手たちはよくやってくれたと思いますが、最後のところ、決めるべきところを決める、最後のところをより質を上げていけるよう、また準備期間は短いですが、個人個人の意識も含めて高めていけるようにしたいと思います。

長崎さんが非常に見事なゲームマネジメントをされて、その辺りもわれわれの反省点です。

そして最後に、ホームゲームで毎回、最後の最後までヴェルディの勝利を願い、祈って応援してくれているファン・サポーターの方に勝利を届けられなかったことは申し訳なく思います。横段幕に掲げられた言葉のとおり、われわれは来期を見据えてのスタートを切っていますし、来季さらに良いサッカーをして勝ち切れるチームになるために、また次の試合に向けて努力していきたい。そしてファン・サポーターの方にたくさんの恩返しができるように、また選手たちと努力していきたいと思います。","[ 手倉森 誠監督 ]
お互いにボールを握るスタイルのゲームになったときに、いかにマイボールと相手ボールのときにメリハリをもって、特に守備ではコンパクトな状態からしっかり相手の縦パスと前方ランニングにしっかり対応していくこと、マイボールになったときは逆に相手もしっかりブロックを組んでくれるので、ユニットでしっかり握り返すようにと。セットプレーで最初に点を取れて、そのあとに２点目と、良い時間帯でトントンと、ヴェルディのスキを突いた形で２－０でゲームを折り返せたというのが非常に良かった。その繰り返しですね。守備では対応して、マイボールになったときに握り返す時間を作って、シュートまでいったときに仕留められるか。ピンチもあって、相手の慌ててくれたシュートに助けられた部分もありましたけど、しっかりしのげて２－０で終われた。こういう辛抱強く戦う覚悟というのが、残り２戦に必要な戦い方だという話をいま選手たちにしてきた。信じて戦い抜くだけかなと思います。

サポーターの多さにものすごく後押しされて、一緒に戦ってくれているサポーターと最後の最後に歓喜を味わいたいなと。お互いに残り２つ、長崎全体で戦っていきたいと思います。"
明治安田生命Ｊ２リーグ　第41節,長崎,甲府,1,1,1,"天国か地獄か。熾烈を極めるＪ１昇格争いはまだ１枠も決まることなく、残り２試合を迎えた。

昇格の可能性を残す３チームで一番下に位置する長崎は、前節はアウェイで東京Ｖと対戦。プレッシャーのかかる試合だったが、前半のうちにセットプレーから先制すると、立て続けに２点目の奪取に成功。その後は２点のリードを活用しながら試合を進めた。理想的な展開で勝点３を獲得し、昇格の可能性をつないだ。

すでに昇格の可能性が消滅している甲府は前節、ホームで松本と対戦。前半に先制を許すと後半に猛攻を仕掛けるが、松本の守備をこじ開けることができずに０－１で敗戦となった。甲府にとっては９連戦の７試合目という影響が出たのかもしれない。そして今節は９連戦の８試合目。さらに中２日で長距離移動でのアウェイ戦と厳しい条件が並ぶ。

長崎は今節で引き分け以下に終わった場合、福岡が勝利すると３位が確定。その時点で昇格の可能性が消滅する。そんな中、リーグで５番目に失点数が少なく、リーグ最多の16引き分けを記録している甲府を迎えるというのはどこか不気味な雰囲気が漂う。甲府に強固なブロックを作られる前にフィニッシュまでもっていくスピード感が勝利へのポイントになるだろう。

どちらにせよ、長崎は逆転昇格のためには残り２試合を連勝するのみ。最終節には徳島と福岡の直接対決があり、どちらかが必ず勝点を落とすことになる。長崎としてはそれが利となる状況にするためにも勝つしかない。

長崎が勝って昇格への望みをつなげるのか。それとも、甲府が壁となって立ちはだかるのか。寒さを吹き飛ばす熱いゲームを期待したい。

［ 文：杉山 文宣 ］","引き分け以下に終われば昇格が消滅する可能性がある長崎。立ち上がりからボールを握り、甲府を押し込んでいく。しかし、後ろを５枚でしっかりと守備を固める甲府の前になかなか決定機を作れない。

しかし、甲府のブロックお構いなしのスーパーゴールが長崎に生まれる。24分、スローインの流れからカイオ セザールがボールを受けると、ゴールまで約30ｍの距離から右足を振り抜く。糸を引くような弾道のシュートは左ポストを叩いてゴールネットへと突き刺さる。先制すれば18勝５分と、圧倒的な勝率を誇る長崎にとっては、これ以上ない形での先制点となった。

先制を許した甲府は押し込む形を何度か作るが、しっかりとブロックを築く長崎の前にチャンスを作れず。長崎が１点リードで前半を折り返した。

後半も構える長崎に対して、甲府が押し込む展開。56分には荒木 翔のクロスを中村 亮太朗が頭で折り返すと、フリーのドゥドゥが頭で合わせる。しかし、これはGK徳重 健太の正面を突いてしまう。押し返せない時間が続く長崎だが、ついに決壊してしまう。67分、CKに中村が頭で合わせ、甲府が同点に追いつく。

昇格へ望みをつなげるには勝つしかない長崎だが、焦りからか攻撃がかみ合わずになかなかチャンスが作れない。83分には氣田 亮真が突破からクロス。これに毎熊 晟矢が合わせるも、シュートはクロスバーの上を通過。長崎はパワープレー気味にボールを前線に入れ、なりふり構わずゴールを目指すが、次の１点が遠い。

終盤のCKにはGKの徳重も上がったが得点は奪えず。試合は引き分けで終了。福岡が勝ったため、長崎の３位が確定。昇格の可能性が消滅した。

［ 文：杉山 文宣 ］","[ 手倉森 誠監督 ]
追う立場のチームらしく、勢いを持って仕掛けて先制できたところまでは良かったです。でも後半に追いつかれて、追いつかれたときもまだ時間がありましたが、ちょっと慌てさせられた展開になってしまい、最後は追加点を奪えなかった。勝たなければ昇格はない中で引き分けてしまったことに対して、昇格への勢いが持続できなかった。われわれの昇格を信じて集まってくれたサポーターには、今年こそということが成し遂げられずに申し訳ないなという気持ちです。福岡と徳島は昇格争いをしていた中で、きっちり勝って昇格を決めたことにおめでとうと言いたいですし、長崎も悔しい思いをした中でクラブの成長、発展というところにより本気になっていければいいなと思います。選手はコロナ禍のタフなシーズンで最後の最後までいろいろな苦難、試練を乗り越えて、そのときにやるべきことを出し尽くして戦ってくれたなと思っています。その中でも昇格できなかったことに対しての悔しさを糧にして前に進んでいきたい。最後のホームゲームは、「このチームがどうして上がれなかったんだ」というようなサッカーを披露して、2020年を締めくくれればなと思います。

－－試合後、ロッカールームの雰囲気は？
口を開く人は誰もいなくて、自分が話をして終わりました。今日の引き分けでわれわれの目標は絶たれましたけど、シーズンを通しての戦いを振り返らなければいけないので、その中で自分が昇格に届くまでの勝点を稼がせてあげられなかったことを反省しているという話をしました。ただ、選手は苦難、試練を乗り越えるために力を注いでくれた。残り１試合、頑張ろうという話をしました。

－－昇格に足りなかった部分は？
チームはいろいろなアクシデントを乗り越えて、強く、たくましくなるために必要なことが目の前で起きている。そこに対して向き合って、みんなが取り組んでくれたと思います。ただ、サポーターも心強く信じてくれて、最後はわれわれもサポーターを巻き込むところまで来たんですけど、クラブマネジメントというかそこに本気になるマネジメント力は、少し自分に足りなかったところかなと。チームだけではなく、クラブもその気になってやってくれたんですけど、絡み方、強化という部分に対して、生身の人間が絡んでいるというところをもっと構築するべきだったなという気もしています。","[ 伊藤 彰監督 ]
遠路はるばる長崎まで、ファン・サポーターのみなさまが応援しに来てくださいまして、ありがとうございます。引き分けという結果でしたけど、追いついて良かったなと思います。

試合内容としては前半、ミドルシュート１本でやられたことと、少し受けてしまった部分と。いろいろとオーガナイズを変えながら、相手のボランチの脇でなんとかゲームをコントロールしたいというところもあったので、そういう意図は見えましたけど、そこに迫力がちょっと足りなかった。前半は裏のランニングが少し足りなかったが、後半に入ってメンバーを代えながらパワーを持って入って、同点に追いついた。ゲームもコンロトールできていましたし、最後、あわよくばもう１点というところもありましたけど、妥当な結果かなと思います。ただ、最後、長崎さんもどうしても勝たないといけないというところで、パワープレーや前にパワーを掛けてきて、裏返して何回かチャンスもあったので、そこで決め切れる力をつけていかないといけない。これが来季、こういうところで勝ち切れるゲームをするというところで、もう一歩上の順位に行けるのかなと思います。そこは今日の反省として、来季に向けてしっかりやっていきたいなと思います。

－－前半悪かった部分と後半良くなった部分は。
ボランチの前でボールを動かし過ぎていた。前半はそこがすごく多かった。１つは（武田）将平がちょっとコンディション不良というかケガも抱えていたのでそれを見つつ、後半に（パワーを）上げたいなというところもあったので、そういう意味では相手のボランチの背中を取れる選手。将平もできるんですけど、今日は申し訳ないですけど、パワーとしてもコンディションとしてもちょっと不良だったのかなと思います。スパッと代えて、（中村）亮太朗を入れたことによって、サイドに入った瞬間にディフェンスラインの間で顔を出せていたのが大きかったかなと思います。"
