Round,Hteam,Ateam,Hscore,Ascore,WorL,Preview,Review,H_comment,A_comment
明治安田生命Ｊ２リーグ　第41節,長崎,岡山,0,1,0,"前節、Ｊ１昇格の可能性が絶たれた長崎が今季ホーム最終戦に臨む。

アウェイで磐田との対戦に臨んだ長崎は開始早々に先制点を奪うなど、二度リードする展開に持ち込みながら追いつかれてしまい、勝点１に終わった。試合終了から約２時間後、京都が引き分けたことで長崎は２位以内の可能性が消滅した。

一方の岡山は前節、ホームで京都と対戦。昇格争いの最中にある京都に対して互角以上の展開を演じ、特に後半は再三の決定機を作り出した。決定力を欠き、得点を奪うことはできなかったが、濃密な内容の試合を演じ、負けなしを11試合に伸ばしている。

昇格の可能性がなくなった長崎だが、今節は勝たなければならない理由がある。11日に今季限りでの現役引退を発表した玉田 圭司にとって、ホームでのラストゲームになるからだ。最近はベンチ外が続いている背番号11だが、公開された25日の練習ではキレのある動きを披露。本人も「ここ何年で一番良いかもしれないくらいに感じている」と笑顔を見せた。「ゴールやアシスト、形に残るものを自分としては最後の試合なので見せられたらいいなと思うし、それ以外でもお客さんが湧くようなプレーをしたい」と語っており、玉田らしいプレーの披露に期待がかかる。

ただ、岡山も24日に有馬 賢二監督の今季限りでの退任を発表。2019年から指揮を執ってきた監督とともに戦うのも残り２試合。連勝すれば１ケタ順位となる９位の可能性もあるだけに、岡山にとっても決して消化試合にはならない。

シーズン最終盤に入り、互いにさまざまな思いが去来する一戦。勝利という結果で笑顔に結びつけるのはどちらか。

［ 文：杉山 文宣 ］","長崎のホーム最終戦。引退を発表し、ホームラストマッチとなる玉田 圭司はベンチスタートとなった。

互いに［４－４－２］で堅い守備が持ち味の両者だけに、なかなか決定機は生まれず。岡山は激しいプレスから高い位置でのボール奪取に成功するも、そこからの質を欠いてしまう。前半終盤には相手クリアミスから岡山が波状攻撃。最後は河野 諒祐が強烈なシュートを放つが、これはGK富澤 雅也がセーブ。直後のCKでは井上 黎生人が惜しいシュートを放つが枠外。前半はスコアレスで折り返す。

後半に入ると早々にスコアが動く。47分、シュートの跳ね返りを回収し、岡山が連続攻撃。最後は石毛 秀樹がカットインから左足を振り抜き、岡山が先制に成功する。

先制を許した長崎は53分、玉田を投入。スタジアム中から大きな拍手が起こり、背番号11がピッチに入った。

64分には加藤 大のクロスをニアサイドで玉田がうまくコースを変えるが、これは枠外。68分には毎熊 晟矢、玉田とつなぎ、ウェリントン ハットがクロス。都倉 賢が頭で合わせるが、これはGK梅田 透吾が難なく処理。

逃げ切りも意識して後ろ重心になった岡山に対し、長崎が一方的に押し込む時間帯が続くが、良い形でエリア内には進入できず、長崎も得点を奪えない。

岡山は88分、濱田 水輝を投入。５バックに変更し、１－０での逃げ切りに完全にシフトする。

岡山は最後まで集中を切らさずに長崎の猛攻をはね返し、そのまま逃げ切り。連続不敗記録を12試合に伸ばした。一方の長崎は最後まで効果的な攻めを打ち出せずに零封負け。ホームで最後の雄姿となった玉田を勝利の花道で送り出すことはできなかった。

［ 文：杉山 文宣 ］","[ 松田 浩監督 ]
ホーム最終戦、たくさんの方々に集まっていただいたにもかかわらず、勝利を届けることができなくて、それが一番、残念です。玉田（圭司）選手の引退セレモニーもあるというこのタイミングで勝って、送り出したかったなというところも残念です。

試合内容に関しては、岡山さんがここのところの好調を持続して、組織立って規律正しく戦ったところが無得点につながったところがある。失点のところはきちっとしたクリアができないというのは基本的なミスではないかなと思うし、それが一瞬のスキなのかなと思いますが、そういうところでやられたというところでまだまだ足りないところがあったなという感じがしています。","[ 有馬 賢二監督 ]
（リーグ戦）後期は選手たちが自分たちがどう戦うのかを理解しながら入ってくれていて、今日の相手もストロングのある長崎さんなんで、そこを消しながらボールを奪いにいくことと我慢することをやってくれた。後半に少しアクシデントもあった中で、準備してきた立ち位置に変えながらしっかりとゴールを取ってくれ、その後もまた立ち位置を変えながらシステムも人も変えながら戦って、（失点）ゼロで終えられた。

Ｊ１昇格争いをしてきた長崎さんにこうやってできたことは本当にチームの成長だと思っています。今日は来ていないメンバーも含めて本当に今週も良い練習ができましたし、一人ひとりの成長がチームの成長につながっていると思う。

今日も長崎まで本当に多くのサポーターが来てくれて、ホームのような雰囲気で応援して最後まで後押ししていただいた。次も勝負事なので簡単ではない。勝点３を取ることは難しいことですけど、またサポーターの皆さんの力をお借りしながら、最後にもう１個勝点３を積み上げられるように頑張っていきたいと思います。"
明治安田生命Ｊ２リーグ　第42節,松本,長崎,1,2,3,"最後は意地とプライドをぶつけ合うゲームになりそうだ。互いに目標達成を果たせなかった両チームの顔合わせ。松本は前節を終えてクラブ初のＪ３降格という非常事態に陥り、長崎もＪ１昇格レースで一歩及ばず４位が確定している。ホームの松本はサポーターへの感謝と贖罪のためかもしれないし、アウェイの長崎はシーズンの集大成とするためかもしれない。それぞれの思いを胸にピッチへ向かう。

松本は昇格を目標に掲げながらも下位に低迷する時期が続き、監督交代を経ても事態は好転せず。Ｊ２残留争いのシックスポイントゲームにほとんど勝てず、逆に早い時間帯から失点を重ねて自縄自縛に陥ってきた。リーグ土壇場で改善傾向にはあったものの、肝心の白星に見放されて10試合勝ちなしのまま降格が決まった。せめてラストゲームは意地を見せ、格上から白星をもぎ取って、少しでも溜飲を下げたいところだ。

阪野 豊史は「降格が決まったからといってＪ２の試合じゃなくなるわけではないし、たくさん応援してくれる方もいると思う。変わらない重みを感じながらやれれば」と力を込め、橋内 優也も「戦う姿勢を見せたいし、ずっと勝っていないので勝ちゲームをしなければ。最大限の努力をしている姿を見てもらえるように、情けないゲームにならないように、最後まであきらめずにやる」と決意を口にする。

長崎は昇格の可能性がついえた直後の前節、岡山に０－１で敗れた。アグレッシブなプレスに苦しみシュート５本に終わり、13試合ぶりの無得点。それでも総得点67はリーグ２位の数字となっており、松本を“お得意さま”とする都倉 賢ら破壊力あるアタッカーが強襲する。ウェリントン ハットは前節を終えて「Ｊ１昇格の可能性がなくなったせいなのか、今までのやる気、テンポが出せなかったんじゃないかなと思う」と話したが、最後はチームとして有終の美を飾らんとするはずだ。

Ｊ３創設以前の10年前はＪＦＬでしのぎを削っていた両チームで、互いにＪ１も経験してさらなる進化を期してきた。しかし松本はつまずいて後退し、長崎ももどかしい足踏み。まずはこの一戦を、次なるステージへのリスタートとしたい。

［ 文：大枝 令 ］","初冬の寒風が吹き抜けるサンプロ アルウィン。クラブ初のＪ３降格が決まっている松本は、高卒ルーキーの横山 歩夢が24試合ぶりに先発するなど、前節から２人を変更した。４位が確定済みの長崎も、カイオ セザールが不在で前節から先発２人を入れ替え。今季ラストゲームに臨んだ。

序盤はホームの松本が優位に立つ。２試合連続スタメンのルカオが前線で起点となり、セルジーニョや横山とのコンビネーションで崩しを図る。しかし、組織立った長崎のディフェンスは簡単には乱れず、チャンスはセットプレーから野々村 鷹人が放った枠内ヘッド１本くらいだった。

そして、虎視眈々とスキをうかがっていた長崎が鮮やかにワンチャンスをモノにする。26分、自陣からのロングフィードで左サイドの裏へボールを流し込む。これを受けた都倉 賢が左足でクロスを入れると、植中 朝日が触って先制。３試合ぶりのスタメンとなった植中が結果を出し、今季10ゴール目と２ケタに乗せた。

その後も長崎が松本の右サイドの背後を弱点と見て、シンプルな攻撃で松本を苦しめる。34分には再び植中が裏を取ってGKと１対１の絶好機を迎えたものの、ここは松本の守護神・圍 謙太朗がビッグセーブを見せて連続失点を回避。圍は36分にも、シンプルに走った都倉の強烈なシュートをはじいて難を逃れた。

後半は松本が榎本 樹を開始から投入して巻き返しを図る。しかし47分、長崎が無慈悲な追加点。自陣で植中が死角からボールを奪取してカウンターを発動。ボールホルダーの都倉を追い越した米田 隼也が左クロスを入れると、ファーサイドのウェリントン ハットがヘッドで仕上げた。松本は不用意なロストから追加点を献上し、さらに状況を悪くした。しかし、松本もすかさず反撃。55分、セルジーニョの右クロスをファーの外山 凌が折り返し、榎本が詰める。こぼれ球を宮部 大己がねじ込んで１点差。さらに、河合 秀人と稲福 卓を投入して陣形を［３－１－４－２］に組み替える。

長崎は79分、植中に代えて現役ラストゲームの玉田 圭司がピッチへ。熟練の左足から繰り出すCKなどで脅威を与えたが、スコアは動かずタイムアップとなった。

［ 文：大枝 令 ］","[ 名波 浩監督 ]
ゲームの総括でいくと、まず横山（歩夢）をスタメンで使いました。コンディションが良く、ゲームパフォーマンスも非常に良く、練習からコーチ陣が毎度毎度ゲーム形式のときにリモコンとして動かしていましたけど、自発的にもだいぶやれるようになっていましたし、本人も自信を持ち始めていました。春先に使ってもらっていた時期とはちょっと違うのではないかと思います。というのはボールに関わる回数が多かったと思いますし、ゴールに向かっていくシーンもありました。実際に３～４回シュートチャンスがあって、思い切り振れたシーンもあって、本人にとっては自信になると思います。前半の終わりくらいにあったカウンターからのファーストタッチで、持ち出しもパーフェクトだったのにシュートを打たなかったという判断で交代という決断をしました。本人にも「パフォーマンスは良かったよ」と言いましたけど、「ビハインドの中でゴールに向かえず、最終的にパスを選択したのがストライカーとしてどうなのか、というのをちゃんと自問自答しようね」ということを伝えました。

ゲームとしては、背後を狙われて先制点を取られてしまった。前がかりになっているところの背後でピンチになっていたかもしれないし、もっと言えば右サイドの野々村（鷹人）の背後をだいぶ使われていてイヤな時間帯が続きました。それもこれも自分たちのポゼッション、オンのプレーが雑すぎたのと、クリアもしくはセカンドボールの拾い合いになるであろうヘディングのパスの質の差が前半は出てしまったなと思います。後半は前がかりになっていましたし、15～20分くらいまで我慢しようかと思ったんですが、思い切ってシステムを変える選択をしました。２トップ、２シャドー、１アンカーにして、セルジーニョと河合（秀人）を並べて稲福（卓）を入れると。２点目の失点はもちろん痛いものでしたけど、その前に１点返したので、だいぶチームも勢いづいていました。それからセカンドボールへのアプローチが甘かったときに２シャドーが追いかけた中、稲福が何度も何度も刈り取る。もしくは刈り取れなくても相手のスピードを殺すようなアプローチができて、攻守一体のチームが躍動感を持って最後の残り30分くらいはやれたんじゃないかと思っています。","[ 松田 浩監督 ]
シーズン最終戦、長崎からもたくさんのファン・サポーターが駆けつけていただいた中、勝利で終われてまずはホッとしています。それに玉田（圭司）選手の最後の試合ということで、勝ちで終われたということでとてもホッとした心境ですが、非常にうれしい勝利になりました。

試合の流れは前半、非常に良かったと思います。追加点を取れていたらもっと良かったんですが、プランどおりに進みました。後半、開始早々に２点目を取れたところまでは非常に良かったと思います。ただ、そのあと自分たちのゴール前でのつなぎのミスから失点をすると、途端に流れが松本さんのほうにいきました。なかなかその流れを引き戻したり、変えたりすることができなかったんですが、なんとかそこをしのいで勝ったかなという気がします。でも、そこでも玉田選手が入ることでちょっと前線に落ち着きを作ってくれたり、タメを作ってくれたりということで、時計の針を進めながら守り切れたかなというのが正直な感想ですかね。"
明治安田生命Ｊ２リーグ　第1節,長崎,東京Ｖ,1,1,1,"一昨季は３位、昨季は４位。Ｊ１昇格が至上命令となる長崎はホームで2022シーズンの開幕を迎える。

昨季はシーズン序盤につまずき、５月に監督交代。松田 浩監督が就任し、強固な守備をベースに驚異的な勢いで勝点を積み上げていった。最終的には昇格に届かなかったが、その戦いぶりを評価し、クラブは今季も松田監督体制の継続を選択した。昨季の主力ではウェリントン ハットや毎熊 晟矢がチームを離れたが、Ｊリーグで圧倒的なキャリアを誇るクリスティアーノを獲得。最終ラインにも高橋 峻希や奥井 諒といった経験豊富なSBを加えることに成功している。松田監督が築き上げたベースに確かな上積みをもたらしてくれるだろう。

一方の東京Ｖも長崎同様、昨季途中に監督交代を経験。最終的には16勝10分16敗、勝点58で12位となった。それでもラスト４試合は３勝１分の好成績を残しており、途中就任だった堀 孝史監督が続投。若狭 大志、佐藤 優平、山下 諒也といった主力がチームを離れたが、６人の新卒に加え、山越 康平や阪野 豊史（右アキレス腱断裂で全治約６カ月の診断）といった経験ある選手が良いバランスで加わった。

両者の直近の対決は昨季の明治安田Ｊ２第38節。その際は長崎が３－０で勝利しているが、54分に山本 理仁が退場するまでは一方的な東京Ｖペースだった。長崎としては、ボール保持に長けた東京Ｖを組織的な守備でうまく捕まえることができるかがポイントだろう。

長崎は直近５年のホーム開幕戦は４勝１分と好成績を残している。今季も白星発進となるか。

［ 文：杉山 文宣 ］","雨中の開幕となった長崎と東京Ｖの一戦。

最初に決定機を作ったのは東京Ｖ。12分、狭い局面で前を向いた山本 理仁がスルーパス。これに反応した佐藤 凌我がシュートするも、GK富澤 雅也が残した右足ではじき出す。

20分過ぎからは、長崎がクロスを頻繁に入れるなど、攻勢をかけペースを奪い返す。その流れから長崎が先制する。25分、CKのボールを都倉 賢が頭で落とすと、こぼれ球はカイオ セザールの足元へ。これをしっかりと蹴り込んだ。

先制を許した東京Ｖだが、徐々にペースを押し返す。33分には左サイドの杉本 竜士のクロスを逆サイドの小池 純輝が折り返す。相手に当たってこぼれたボールに石浦 大雅が反応するが、シュートは枠外。それでも37分、東京Ｖが追いつく。左CKがファーサイドまで流れると小池が折り返す。これに反応した杉本が頭で流し込んだ。

後半に入ると、ボールを保持する東京Ｖがペースを握る。しかし、ラストサードで質を見せることができずに、得点は奪えない。ともに前線の選手を投入し、活性化を図るも、互いに決定機が生まれない時間が続く。

76分に長崎にようやく決定機。クリスティアーノのクロスに山崎 亮平が飛び込むもわずかに合わず。対する東京Ｖも79分、パスをつなぎ、最後は前線に飛び出した山本がシュートを放つが、うまくミートせず枠外に。

85分には加藤 聖が突破からクロス。これをゴール前でエジガル ジュニオが合わせるが、これはGK高木和 徹の正面を突いてしまう。

長崎は終了間際にも波状攻撃でゴールに迫るが、最後まで東京Ｖの守備をこじ開けることはできず。ともに欲しかった白星スタートを手にすることはできずに、勝点１を分け合った。

［ 文：杉山 文宣 ］","[ 松田 浩監督 ]
開幕戦ということで、ホームでもありましたし、雨の中、集まっていただいたサポーターの前で勝点３を取りたかった試合だったので、残念だったなという感想です。簡単じゃないなということと、東京Ｖさんがかなり良いチームだということで、最後は打ち合いみたいな試合になってしまったことが、勝点３をしっかり取りにいくということからするとやるべきではなかったのかどうか。これは結果論なので分からないですが、ボール回しがうまいチームに対する戦い方や１点リードしたあとの戦い方をもうちょっと整理して、今日は開幕戦だったから自重するところが足りなかったかなという気がしますが、そんな感想です。あとは新加入の選手がそれぞれの持ち味を出してくれたし、交代した選手がチームにパワーを与えてくれたことがうれしかった。チームの底上げができていると感じたことがこれから長いリーグ戦を戦う上で良かった点かなと思います。

－－２トップの出来について。また、交代でさまざまな形を使ったが。
２トップはキャンプを通じて、準備期間で一番コンディションの良かった選手を起用したということです。その選手をどう配置するかという中で起用しました。最低限の仕事はしてくれたと思いますし、先制できる流れも作ってくれたという意味では及第点を付けていいかなと思います。エジガル（ジュニオ）はどの程度できるか未知数でしたが、クリスティアーノと組ませることで相手に対する圧力を掛ける。エジガルもそのほうが言葉も通じるし、やりやすいと思い、助けてもらいながらやるという意味で。結果、ゴールを取ってくれればということでした。最後のほうは、クリスティアーノと（加藤）聖から質の良いクロスを上げる狙いで二見（宏志）を入れて、聖を１列上げる。今日、初めてやりましたが、非常に良かった。複数のポジションをいろいろな選手ができるようになって、その時々のメンバーによっていろいろなことが試せるなと思いました。ヤマ（山崎 亮平）もトップとサイドハーフでエネルギッシュで効果的なプレーをやってくれた。交代で出た選手があれだけ活躍してくれて、エキサイティングなサッカーを持続できたらいいなというのは感じました。","[ 堀 孝史監督 ]
先に失点してしまったが、そこから取り返すことができた。後半、もう少し攻撃できればという中だったが、選手たちはよく走り、戦ってくれた。次につながる試合だった。

－－日ごとに、コロナウイルスの陽性者が出る状況だった。マネジメントで意識したところは？
この流れは変えられない。選手たちはしっかりと、常に準備してくれている。

－－試合後、ピッチ横で作った円陣で掛けた声は？
選手たちはしっかりと戦ってくれて、走ってくれたと思う。３ポイントは取れなかったが、アウェイで点を取れて、良いゲームだった。

－－サッカーの内容として、手ごたえがあるのでは？
難しい時間もあったが、選手たちがどういうふうにすればいいかを考え、それを出してくれたところで自分たちのリズムにもっていけた。ただ、最後のところで少し何かができたかなと思う。"
